title,content,href
수컷 고양이 중성화,안녕하세요. 저는 몇 달 전인 6월말에 평소와 같이 산책을 하다가 다리를 다친 아기 고양이를 보고 차마 무시할수가 없어서 처음으로 고양이를 키워보게 된 초보 집사입니다. 즉시 병원에서 상태를 확인하니 나이는 당시 한달반에서 2달이라 하니 지금은 대략 8~9개월짜리 수컷 고양이라고 보시면 될거 같습니다. 어릴때부터 워낙 안고 키우던지라 사람을 잘 따르고 온순하게 자라서 야외에 집을 지어주고 마당에서 놀게 하고 있는중입니다. 워낙 고양이보다 사람에 대한 관심이 더 높기도 해서 개냥이라고 부르기도 할 정도입니다. 키우는 곳이 논이 있고 한 시골의 단독주택인지라 고양이들이 많긴 하지만 자기 집을 영역으로 인식하고 있어 왠만해서는 집앞을 벗어나지 않는 상태입니다. 저는 왠만해서는 고양이한테 칼을 댄다는것이 죄책감이 들고 미안해지기도 해서 굳이 필요한가에 대한 의문이 들기도 하지만 커가면서 가족분들이 중성화가 필요하지 않겠냐는 의견들이 오가기에 아직 스프레이나 발정기의 모습이 보이고 있지 않기에 중성화 수술이 필요한지에 대해 한번 여쭤보고 싶습니다.,https://kin.naver.com/qna/detail.naver?d1id=8&dirId=80511&docId=490527486&qb=6rOg7JaR7J20&enc=utf8
고양이 알레르기 증상 가려움,고양이 알레르기 증상 일까요?약간 두드러기 처럼 올라오고 가려운 단계인데알레르기 약 어떤걸 먹어야 할까요?,https://kin.naver.com/qna/detail.naver?d1id=8&dirId=80511&docId=492227655&qb=6rOg7JaR7J20&enc=utf8
고양이 몸에 딱지? 상처?,저희집 고양이 몸에 어느 순간부터 땜빵이 생겼는데 딱지진것 처럼 뭐가 만져지고 고양이가 가려웠는지 그 상처주면 털이 없더라고요 그랴서 혹시나 해서 무슨 증상인지 궁금해서요,https://kin.naver.com/qna/detail.naver?d1id=8&dirId=80511&docId=492390932&qb=6rOg7JaR7J20&enc=utf8
고양이가 아파요,고양이가 다이소에서 산 캣 그라스와 원예상토를 두고 키우다가 오늘 먹었는데 아픈지 계속 누워만 있고 힘이 없어요 어떻게 해야 하나여 너무 걱정됩니다(내공300),https://kin.naver.com/qna/detail.naver?d1id=8&dirId=80511&docId=491853762&qb=6rOg7JaR7J20&enc=utf8
고양이가 자꾸 부들부들 떨어요…ㅠㅠ,고양이가 자꾸 아무것도 안했는데 안고있거나 만지면 부들부들 떨어요 근데 또 떠는게 떨었다가 안 떨었다가 반복하는데 그냥 싫어서 그런걸까요ㅠㅠㅠㅠㅠㅠㅠㅠㅠㅠㅠㅠ 고양이랑 어떻게 친해지나요 간식도 자주 주고 츄르도 주는데 걍 저를 개무시해요;뭐지,https://kin.naver.com/qna/detail.naver?d1id=8&dirId=80511&docId=491854069&qb=6rOg7JaR7J20&enc=utf8
고양이가 토를 해요,"4살 된 고양이와 함께 살고 있어요 19일에 헤어볼을 토한 흔적을 발견했고 20일에 4시쯤 사료두알정도 섞인 토, 6시30분쯤 공복토를 발견했고 헤어볼을 토한 뒤로 사료가 전혀 줄지않아서 식욕이 있는지 확인을 위해 20일 11시20분쯤 츄르를 급여했고 12시30분쯤 화장실에 츄르를 그대로 토해냈습니다 혹시 헤어볼을 토하고 나면 계속 토를 하나요??ㅜㅜㅜ",https://kin.naver.com/qna/detail.naver?d1id=8&dirId=80511&docId=492087885&qb=6rOg7JaR7J20&enc=utf8
고양이 눈 왜이런걸까요..,어제 눈꼽이 많이 껴있길래 닦아주고 고양이 전용 인공눈물을 넣어줬는데 오늘 눈이 이런데 왜그런걸까요..?병원 가는게 맞을까요..?ㅜㅜㅜ,https://kin.naver.com/qna/detail.naver?d1id=8&dirId=80511&docId=492112091&qb=6rOg7JaR7J20&enc=utf8
고양이 딱지,고양이가 딴 고양이랑 싸우다가 좀 상처가 깊게 났었는데 이제 딱지가 앉았어요. 근데 고양이도 계속 딱지를 간지러워 하고 딱지도 떨어질 것 같은데 딱지 위로 새 털이 나요.고양이는 딱지가 떨어지는게 아닌가요?,https://kin.naver.com/qna/detail.naver?d1id=8&dirId=80511&docId=492269066&qb=6rOg7JaR7J20&enc=utf8
고양이 하루 세번 토,고양이거 하루 세번 토했는데요평소에는 이렇지 않구요첫 토는 사료 불은 토 두번째랑 세번째는 물토인데 노랑? 연두 그 중간이에요,https://kin.naver.com/qna/detail.naver?d1id=8&dirId=80511&docId=492057081&qb=6rOg7JaR7J20&enc=utf8
고양이 중성화 오줌,고양이 중성화 한지 몇 시간 안 지났는데 자꾸 자면서 오줌싸네요 원래 이런 건가요? 그리고 붕대 때문에 잘 못 걷는 건지 마취가 덜 풀려서 잘 못걷는 건지 모르겠어요,https://kin.naver.com/qna/detail.naver?d1id=8&dirId=80511&docId=492178500&qb=6rOg7JaR7J20&enc=utf8
고양이 피부병 뭘까요,길고양이입니다귀 옆 목덜미 따라서 쭉 털이 빠지고 피부병이 생겼어요처음에는 다른 고양이한테 물린줄 알았는데 어느순간 반대쪽도 그렇게 되는거 보고 피부병 같다는 생각이 들어요계속 긁어서 더 심해지는거같은데 링웜은 아닐지 걱정돼요한달정도 된거같아요,https://kin.naver.com/qna/detail.naver?d1id=8&dirId=80511&docId=492474966&qb=6rOg7JaR7J20&enc=utf8
고양이 식음전폐,키우는 고양이(3살) 아기가 십자인대가 끊어져서 수술한지 일주일 됐어요토요일날 퇴원했는데 물도 잘 안 마시고 밥은 아예 안 먹네요혹시 몰라서 다시 병원 갔더니 장에 변이 가득 차서 일단 변비약 먹이고 지켜봤는데 오늘 변도 보고 물도 조금은 마셨는데 여전히 아무것도 안 먹어요간식이나 습식캔을 까서 보여주니까 냄새 조금 맡다가 입맛 다시긴 하는데 절대 먹진 않는데 왜 이럴까요…,https://kin.naver.com/qna/detail.naver?d1id=8&dirId=80511&docId=492157444&qb=6rOg7JaR7J20&enc=utf8
고양이 잇몸에서 피가 나요,평소처럼 양치를 시키는데 뭔가 이상해서 보니까 피가 나고 있었어요ㅜㅠ 당장 병원에 가야하는 사안일까요?ㅜㅜ 아기는 5개월 된 고양이예요..,https://kin.naver.com/qna/detail.naver?d1id=8&dirId=80511&docId=492063558&qb=6rOg7JaR7J20&enc=utf8
"고양이 미용 후 병원비 청구, 법적 대응 가능할까?","고양이 미용사입니다.(무마취 미용) 보호자가 미용때문에 고양이가 아프다고 병원비의 50%를 청구합니다. 어찌하는게 좋을지 법적인 의견을 구하고 싶습니다.2월 25일 - 고양이 미용.2월 28일 - 보호자가 고양이 하반신 마비 증상으로 병원에 대려감.2월 30일 - 보호자가 미용 스트레스가 원인이라며 병원비 50%를 청구함. 3월 10일 - 보호자가 동물병원 진료기록부를 보여주며 미용 스트레스가 원인이라며 병원비를 재차 정구함. 고양이는 현재 완치 상태임.진료기록부 내용 : 비대성 심근병증에서 나타나는 증상이다. 다만 심한 스트레스로 인해 일시적 심근 비대병증이 나타났을 수 있다.보호자 주장 - 고양이가 심하게 울었으면 거부의사를 보인건데 미용사가 강압적으로 미용을 진행 했다. 병원에서도 일시적 스트레스에 의한 증상일수 있다 하니, 강압적인 미용이 원인인 거 같다. 1차 병원 진료 후 2차 다른 병원에 갔는데, 비대성 심근병증은 아닌거 같다는 의사 진단이 있다. 그러므로, 기저질환에 의한 문제는 아니고 미용이 원인이다.우리측 미용사 입장 - 미용 전에 보호자에게 고양이 기저질환이 있는지, 컨디션은 좋은지 물어봤으나 사전 알림 내용은 없었다.고양이가 심하게 울긴 했으나, 무마취 미용의 특성상 대부분의 고양이들이 심하게 거부 의사를 표한다.2년 넘게 미용 일을 해 왔는데 이런 일은 처음이며, 특별히 해당 고양이만 강압적으로 대하진 않았다.그런데 이런 일이 생겼다는 것은 아무리 생각해도 해당 고양이의 기저 요인이 큰 원인이다.미용 다음날(26일) 보호자와 문자로 고양이의 상태를 체크했으며, 아무 문제 없이 잘 지낸다는 답장을 받았다. 그런데 3일 후 병원 간게 미용 문제라 하니 받아들이기 어렵다.   관련태그: 기타 재산범죄, 고소/소송절차",https://kin.naver.com/qna/detail.naver?d1id=6&dirId=60215&docId=492409892&qb=6rOg7JaR7J20&enc=utf8
고양이 질문이에요 ㅜㅜㅜ,저번에도 이 질문 바탕으로 올렷엇는데 고양이가 묽은 변을 자주 본다고요. 괜찮은 변을 본 적은 이주일에 한번 아니면 거의 다 묽은 변을 봐요. 묽은 변 때문에 간식을 아예 잘 안주고 주고 싶어도 못 주고.. 요즘들어 고양이가 간식을 자주 못 먹어서 스트레스를 받지 않을까 이것또한 걱정인데 아무래도 사료 문제일까요? 이주일에 한번 멀쩡한 변을 보는 것도 이제 거의 없어요 ㅠㅠ 다 똑같이 묽은 변만 보네요.. 병원도 데려가보긴 할텐데 아무래도 사료 문제겠죠? 문제의 해결과 묽은 변 안볼 수 있는 건강한 사료 추천해주세요…,https://kin.naver.com/qna/detail.naver?d1id=8&dirId=80511&docId=491931073&qb=6rOg7JaR7J20&enc=utf8
고양이 기생충??,키우는 고양이가 입에 뭐가 걸려서 막 씹고 있길래 봤더니 아래 사진 같은 게 나왔는데 생긴게 무슨 연가시? 기생충? 뭐 이런거 같이 생긴거에요 ㅠ이게 뭔지 아시는분 계실까요잘 안끊어지고 살짝 누르스름해요,https://kin.naver.com/qna/detail.naver?d1id=8&dirId=80511&docId=491368727&qb=6rOg7JaR7J20&enc=utf8
고양이 가래 재채기 약,안녕하세요 고양이 전문가분들께 도움 구합니다ㅠㅜ 지리산자락에 살면서 밥주는 산고양이가 있는데요 한 두세달 전부터 골골소리가 좀 이상하고 재채기를 하더라구요 사람이 없을땐 아무문제 없어 보이는데 예쁘다고 좀 만져주고 하면 기분좋아서 골골골 하잖아요? 그때 가래끓는 소리가 좀 나면서 재채기를 해요 힘들어 하는 것 같아서 만져주지도 못하고요ㅠㅠ 귀랑 털도 깨끗하고 세수도 잘해서 눈곱도 잘 없어요 콧물은 안나구요 밥도 잘먹고(엄청) 추워지면서 미지근한 물도 챙겨주면 잘 마셔요 사람손은 타는데 어디 데리고 가지는 못하겠어요 병원에서 약을 처방받을 수 있나요? 호흡기질환 같은 걸까요..? 완전히 책임질수도 없어서 사실 크게 정 안주려고 하는데 밥챙겨주다보니 또 그게 안되네요 혹시 정보가 있으시다면 도움 부탁드려요!,https://kin.naver.com/qna/detail.naver?d1id=8&dirId=80511&docId=491412239&qb=6rOg7JaR7J20&enc=utf8
고양이 사료 토 (토 사진이 있어요 주의해주세요),"고양이가 사료를 먹고 자꾸 토를 합니다. 토를 한지는 꽤 됐습니다. 다른 고양이를 데려오면서 합사가 잘 안되었었는데, 그때 스트레스를 엄청 받은 것 같습니다. 그이후로 일주일에 6번 이상은 사료를 그대로 토를 합니다. 사료를 먹을때도 씹어먹지 않고 급하게 먹어서 토를 하면 사료가 그대로 나옵니다. 슬로우 식기를 사용하면 밥을 안먹고 시간마다 밥을 배식해주기엔 집에 한가한 사람이 없습니다. 해결법 좀 알려주세요.",https://kin.naver.com/qna/detail.naver?d1id=8&dirId=80511&docId=491855843&qb=6rOg7JaR7J20&enc=utf8
3살 정도 된 고양이가 한 번에 토를 너무 많이 했어요.,한번도 이런적 없었는데 오늘 새벽에 갑자기 토하는 소리가 나서 일어났는데 이미 여러번 토한 자국이 있었습니다.처음엔 사료토를 한 거 같고 점점 흰색 물토?를 하더니 마지막쯤 토는 거의 노란색 토를 했습니다. 2일 전에 아빠께서 비요뜨 막 입에 묻히셔서 소량의 비요뜨를 먹었는데 그게 문제였던 걸까요? 보니까 토를 한 뒤부터 오줌이랑 똥은 안 싼 거 같고 그 전엔 잘 쌌고 잘 먹고 잘 마셨습니다. 심지어 이미 토를 했으면서 또 사료를 먹고 다시 토하더라고요. 진짜 아주 조금 토한 거까지 다 합치면 10번 이상의 토를 한 거 같아요. 병원을 가야하긴 하는데 저희 집이랑 너무 멀어서 고양이가 많이 스트레스받아 하고 멀미도 하던데 바로 병원에 가야 할까요?ㅠㅠ 조금 더 지켜보자니 설날이라서 5일은 병원이 쉬는데 지금 제가 바로 할 수 있는 게 뭐가 있을까요? 일단 오늘 당장 병원을 갈 수는 있습니다! 고양이 상태가 별로라 좀 그렇지만 병원 방문 가능합니다.,https://kin.naver.com/qna/detail.naver?d1id=8&dirId=80511&docId=491948351&qb=6rOg7JaR7J20&enc=utf8
고양이 건강검진...,고양이 건강검진이랑 스케일링 하고 온 뒤로 2틀 째까지는 밥 잘 먹고 잘 돌아다녔는데 3일 째부터 토하고 계속 침흘리고 평소에 안 하는 울음소리로 계속 울고 다니고 밥이랑 물도 아예 안 먹어요 화장실도 며칠째 안 가고요 건강검진에서는 아무 문제 없다고 나왔었는데 진료나 스케일링이 잘 못 된 걸까요? 한번도 이런 적 없고 워낙 얌전했던 아이라 너무 걱정입니다 병원에 물어보니 그냥 스트레스 때문이라 그러는데 검진하고 이런적이 없었어서요 4일째 이래서 걱정입니다,https://kin.naver.com/qna/detail.naver?d1id=8&dirId=80511&docId=492287825&qb=6rOg7JaR7J20&enc=utf8
고양이 사료토,오늘 밤 11시부터 고양이가 사료토를 5번정도 했는데 지금은 쩝쩝대다가 자고있어요ㅠㅠㅠㅠ 사료 덩어리를 그대로 토해냈는데 몇개월전에 몇번하고 사료접시 바꾸고(높이조절되는걸로) 나서는 한동안 토 안했었거든요?ㅠㅠㅠㅠ 근데 오늘 갑자기 어제까지 멀쩡한 똥싸고 잘먹고 하다가 이게 무슨일인지.. 아침에 바로 병원 가야하는 상황인지.. 이런적이 처음이라서요 ㅠㅠ 보통 2번하고 마는데ㅠㅠㅠㅠㅠㅠ,https://kin.naver.com/qna/detail.naver?d1id=8&dirId=80511&docId=491800093&qb=6rOg7JaR7J20&enc=utf8
고양이 기침? 헛구역질? 구토? 왜이러는 건가요ㅠㅠㅠ,고양이가 동영상에 보이는 것처럼 수십초간 반복하다 안 하고 또 짧게 하다가 안 하는데 이렇게 배 속에서부터 끌어오는 듯한 기침은 왜 이러는 걸까요?ㅠㅠ 토는 안 하네요ㅠ,https://kin.naver.com/qna/detail.naver?d1id=8&dirId=80511&docId=492257517&qb=6rOg7JaR7J20&enc=utf8
저희집 고양이 어떤가요??,저희집 고양이가 방광염이 있는데 최근에 다시 재발했단말이에요.그래서 병원에서 치료받고 어제 병원가서 주사도 맞고 왔는데 오늘 아침에 화장실을 갔는데 확인해보니까 너무 깨끗한거에요.2번정도 갔는데도 그치만 밥도 잘먹고 물도 많이 먹었어요.만져주면 평소처럼 그르릉도 하고 이게 이렇게 생각이 계속 들다보니까 행동도 평소랑 달라진거 같고 어떻하나요???,https://kin.naver.com/qna/detail.naver?d1id=8&dirId=80511&docId=491344103&qb=6rOg7JaR7J20&enc=utf8
고양이 토,1살 고양이가 토를 자주 하는데 왜그럴까요ㅠㅠ? 간식 잘 안 주고 밥은 자동급식기로 하루 세 번 줍니다..ㅠㅠ본인 음식 아니면 입도 안 대는 애라 뭐 잘못 먹어서 그런 것 같지도 않고.. 털갈이에 헤어볼 토를 자주 하나요?ㅠ 장모종이긴 합니다ㅠㅠ아ㅏ 근데 헤어볼이면 덩어리가 나와야 하지 않나요? 덩어리는 없는데.. 사료가 안 맞는 걸까요ㅠㅠ,https://kin.naver.com/qna/detail.naver?d1id=8&dirId=80511&docId=491420214&qb=6rOg7JaR7J20&enc=utf8
"고양이 3,4일 혼자 있어도되나요?","고양이 한마리 키우는데 집에 3, 4일정도 혼자 있어도 괜찮을까요…혼자 있어도 많이 문제가 될까요??우울증이 걸린다던지..4일정도 혼자 있어도 될까요???이틀정도 집을 비웠을때는 생각보다 잘있었어요",https://kin.naver.com/qna/detail.naver?d1id=8&dirId=80511&docId=491336584&qb=6rOg7JaR7J20&enc=utf8
고양이 중성화 수술,안녕하세요7살 고양이 전체 피검사지인데 중성화 진행해도 되나요?혈청이 빠진게 있다는데 중성화 수술시에 필수로 해야하는 건가요?,https://kin.naver.com/qna/detail.naver?d1id=8&dirId=80511&docId=491944377&qb=6rOg7JaR7J20&enc=utf8
고양이 목 상처,며칠전에 고양이 목에 상처가 났는데 처음에는 그냥 다른 고양이랑 싸워서 생긴 상처인줄 알고 피만 닦아줬는데 오늘 확인해보니까 이상한 냄새도 나고 딱지가 생겼어요 심각한건가요? 동물병원 꼭 데려가야하는정도인가요? 그정도는 아니라면 어떤 약 발라주는게 괜찮을까요,https://kin.naver.com/qna/detail.naver?d1id=8&dirId=80511&docId=492237707&qb=6rOg7JaR7J20&enc=utf8
고양이가 자꾸 토해요,"4개월 된 고양이가 2일 전 머리끈을 삼키고 머리끈을 다 토해냇는데도 많이는 아니지만 2번씩 공복토, 사료토를 하네요 ㅠㅠ 기력이 없는건 아니구요.. 내일은 동물 병원이 문을 닫아서... 갑자기 안 좋아지는 건 아니겠죠 ㅠㅠ? 구토 색은 투명하거나 연한 갈색, 사료 토입니다",https://kin.naver.com/qna/detail.naver?d1id=8&dirId=80511&docId=491418998&qb=6rOg7JaR7J20&enc=utf8
고양이 발톱 지간염? 검은 껍질,1살이 안된 고양이 입니다발톱을 깎이려고 보니 검은 점같은 각질들이 발톱 사이에 덕지덕지 붙어있어요한쪽만 그런게 아니라 다른쪽 다리에도 군데군데 있습니다지간염의심되는데 맞을까요? 맞다면 돈을 마련해야해서 병원 치료 비용이 어느정도 되는지 알고싶어요,https://kin.naver.com/qna/detail.naver?d1id=8&dirId=80511&docId=492378852&qb=6rOg7JaR7J20&enc=utf8
저희집 고양이 털색이 이상해요,저희집 고양이 털 일부가 희연데 이거 어디 아파서 그런 걸까요...? 아니면 별 문제 없나요,https://kin.naver.com/qna/detail.naver?d1id=8&dirId=80511&docId=491751193&qb=6rOg7JaR7J20&enc=utf8
고양이 귀 상처,저희집 고양이 귀에 어느순간 피멍 든 것처럼 검정색 점이 생기고 근처에 상처가 있는데 이건 어디에 찍힌 걸까요?반대쪽 귀에도 검정색 점 같은 게 생기려고 해서 귀를 털다가 상처를 난건지 신경을 안써도 되는건지 모르겠는데 계속 걱정이 되어서 문의드려요,https://kin.naver.com/qna/detail.naver?d1id=8&dirId=80511&docId=492327171&qb=6rOg7JaR7J20&enc=utf8
암컷 고양이 중성화 비용,암컷 고양이 1~2살 정도 되는데 발정기가 온 것 같아요.. 명절 끝나고 중성화 시키려고 하는데 병원마다 다르겠지만 중성화 비용이 대략 어느정도 들까요? 덤탱이 맞고 싶지 않아서요 ㅠㅠㅠ 수원 용인 쪽에 잘하는 병원 추천도 좋아요 가격이 안 비쌌으면 좋겠어요..,https://kin.naver.com/qna/detail.naver?d1id=8&dirId=80511&docId=491900077&qb=6rOg7JaR7J20&enc=utf8
고양이 기침,고양이가 영상처럼 기침을 하는데 당장 응급실을 가야 할 상황일까요?? 기침은 아침부터 시작했고 아침에 먹은 밥도 다 토했습니다.. 명절이라 원래가던 병원에 목요일에야 갈 수 있는데 응급실에 지금 당장 가야할지 목요일까지 기다려도 괜찮을지 궁금합니다..!,https://kin.naver.com/qna/detail.naver?d1id=8&dirId=80511&docId=492009658&qb=6rOg7JaR7J20&enc=utf8
고양이 배에 상처? 아토피?,3일전에 고양이가 그루밍도 많이하고 고양이 배에 이런게 생겨서 오늘 병원가려고 했는데요. 오늘 다시보니까 상처?같은게 거의 가라안고 그위에 털도 다시 났더라고요. 그루밍도 정상적으로 하고요. 그래서 병원 안갔는데요… 저건 대체 왜 났던 건가요?,https://kin.naver.com/qna/detail.naver?d1id=8&dirId=80511&docId=490332371&qb=6rOg7JaR7J20&enc=utf8
고양이 눈 위 눈썹 부분 빨개짐,오늘 오전부터 고양이가 눈 위 (귀 바로 밑부분) 털 없는 부분이 빨개젔어요. 한쪽만 이러는데 알러지인건가요? 아니면 어디 부딪혀서 다친 걸까요?ㅠㅠ,https://kin.naver.com/qna/detail.naver?d1id=8&dirId=80511&docId=492454197&qb=6rOg7JaR7J20&enc=utf8
생후 2개월에서 3개월 되가는 아기고양이 사료,"건식 사료를 먹야하나요? 습식사료를 먹여야 하나요 또 건식사료를 먹인다면 물에 불려서 먹여야할지, 그리고 아기고양이 전용 사료도 추천 부탁드려요!",https://kin.naver.com/qna/detail.naver?d1id=8&dirId=80511&docId=490408835&qb=6rOg7JaR7J20&enc=utf8
고양이 링웜,저희집 고양이 발 뒷꿈치에 털이 없는데 이게 뭔가요…귀쪽에도 털이 아주조금 점찍은것 처럼 없어요,https://kin.naver.com/qna/detail.naver?d1id=8&dirId=80511&docId=492153885&qb=6rOg7JaR7J20&enc=utf8
고양이 욕창 수컷남자애 중요부위 양옆..?,고양이 스코티쉬폴드 두마리를 키우고있는 집사입니다.첫째가 유전병이 심해서 척추가 살짝 휘고 아파요 하루 집을 비우고 집에 오니 침대며 쇼파며 피가 뭍어있어 보니 소중이 양 옆으로 까져있더라고요 너무놀래서 야간병원갔더니 욕창이라고 주사놔주고 항생제 약이랑 연고 처방해주셨어요 제 질문은 -의사선생님이 귀저기를 채워놓으래서 채워놨는데 평일에 제가 아침에 일을나가서 저녁에 오면 볼일도 못보고 어떻게 하는게 나을지..-욕창 빨리 낳는 방법-다리부위였다면 붕대같은거 솜으로 덧대서 둘러줄텐데 중요부위 양 옆이라 뭘 덧댈수도 없으니.. 창의력 발휘해서 어떻게 붕대를 덧대거나 해결방안을 주시는분께 카톡으로 배민기프티콘 드릴게요 부탁드립니당,https://kin.naver.com/qna/detail.naver?d1id=8&dirId=80511&docId=492312128&qb=6rOg7JaR7J20&enc=utf8
고양이 방광염 증상 병원 가야할까요?,"8살 된 고양이 키우는 집사 입니다.원래 방광염을 가지고 있어서 요도에 슬러지가 있음. 계속 처방사료를 먹고 살고 있고 1년에 한번씩은 겨울쯤 꼭 방광염 증상이 나타나요.그 때 마다 병원에 바로 데려가서 약(스트레스완화) 먹였고 바로 나아졌어요.근데 이번에 1월 8일쯤 증상이 나타나서 물을 많이 먹였고 바로 오줌 크기가 커지길래 아예 못 싸는건 아니구나 하고 물 아침 저녁으로 간식타서 챙겨주고 계속 체크 했습니다.근데 이번에 처음으로 오버그루밍인지 한쪽 팔에 털빠짐이 있더라구요ㅠ 그리곤 큰 감자 (원래 소변 크기) 도 나오고 그러다 가끔 작은 감자 (방광염 증상 나타났을 때 보다는 큰 사이즈) 도 나오는데 병원에 가서 약 처방 받아오는게 나을지, 아니면 더 지켜보는게 나을 지 고민 됩니다.털빠짐 오버그루밍이 있어서 바로 가보는게 나을까요?",https://kin.naver.com/qna/detail.naver?d1id=8&dirId=80511&docId=491606181&qb=6rOg7JaR7J20&enc=utf8
사람먹는 기생충약 고양이 먹여도 되나요?,밖에서만 생활하던 고양이를 집에서 키우게 되엇는데기생충이 나왔어요오늘 일요일이라 근처 동물병원 문 연곳이 없는데약국에서 사람먹는 기생충약 사와서 먹여도 될가요 ???,https://kin.naver.com/qna/detail.naver?d1id=8&dirId=80511&docId=491560863&qb=6rOg7JaR7J20&enc=utf8
고양이 토,오늘 고양이가 토하기 전 증상을 좀 심하게 하더라고요. 근데 토는 안 나왔어요. 심각한 걸까요?,https://kin.naver.com/qna/detail.naver?d1id=8&dirId=80511&docId=492275545&qb=6rOg7JaR7J20&enc=utf8
저희집 고양이가..,올해.. 17살이 되었어요... 물론 8월이 되야하지만...... 그런데.. 작년인가? 그때부터 이상하게 빼빼 마르고...밥은 원래 잘안먹지만 먹고.. 달라진 점은 물을 엄청나게 자주 마신다는거에요.....원래 이렇지 않았는데.... 왜 이러는걸까요....?고양이들은 신장이 자주 나뻐진다고 하던데...고양이 신장영양제 같은걸 먹여도 괜찮을까요.....?나이가 많고... 말라서... 걱정이 많이 되요.....,https://kin.naver.com/qna/detail.naver?d1id=8&dirId=80511&docId=492459014&qb=6rOg7JaR7J20&enc=utf8
고양이 토,"고양이가 계속 토를 해요밥 먹는 소리 들리고 한 1-2초 있다가 바로 토 하는 소리가 들려요헤어볼은 아닌데 사료가 모양 그대로 나오고 노란색인데 오늘 묽은 액도 같이 나왔어요 저번주 일요일에 2번, 어제 두번, 오늘 두번 이렇게 했어요고양이 지금 6살이고 5.4키로 정도에요사료도 고양이 입양했을때부터 쭉 먹이던 사료에요저번에도 토 이렇게 자주는 아닌데 몇번해서 동물병원 데려갔더니 아무 문제 없다고 하셨거든요 그게 한 5달 정도 됐는데 지금 어떻게 해야될지랑 왜 그런지 알려주실수있나요",https://kin.naver.com/qna/detail.naver?d1id=8&dirId=80511&docId=492034288&qb=6rOg7JaR7J20&enc=utf8
