title,content,href
저희 고모께서 고양이를 키우신다는데,저희집에 단 한 번도 고양이를 데리고 오신 적이 없어요. 고양이는 데리고 다니기 힘들다는데 왜 그런가요?사람들이 강아지는 많이 데리고 다니는데...,https://kin.naver.com/qna/detail.naver?d1id=8&dirId=80502&docId=492444070&qb=6rOg7JaR7J20&enc=utf8
강아지가 고양이한테 마운팅,저희집 암컷인강아지가 수컷(중성화한)고양이한테 마운팅을 하는데 왜 이런걸까요 고양이성격이 화도 안 내고 엄청 착해서 강아지가 마운팅하는걸 거부를 안 하는 것같기도하고... 어떻게해야 안 할까요ㅜㅜ,https://kin.naver.com/qna/detail.naver?d1id=8&dirId=80511&docId=489152152&qb=6rOg7JaR7J20&enc=utf8
1살다되가는 수컷고양이 중성화,저희 고양이 데려온지 얼마 안되서 예방접종은 안맞았는데 중성화가 안되어있어서 중성화시킬려고 하는데 괜찮을까요?중성화 시키기전에 검사같은거 한다는데 언제쯤 해야 수술 할수있나요..?,https://kin.naver.com/qna/detail.naver?d1id=8&dirId=80511&docId=488494449&qb=6rOg7JaR7J20&enc=utf8
고양이가 밥을 안 먹어요ㅜ,집에 샴 고양이 4살짜리가 있어요. 그런데 요즘 입맛을 잃었는지 사료를 잘 안 먹으려고 하네요. 괜찮을까요??,https://kin.naver.com/qna/detail.naver?d1id=8&dirId=80511&docId=491519237&qb=6rOg7JaR7J20&enc=utf8
고양이 상처?,저희집 고양이 귀 앞쪽 이마라고 해야하나 거기에 털도 빠져있고 상처난것처럼 저런 모습인데뭐가 난건지ㅠ 긁힌건지 감이 안오네요 바로 병원 가야할까요?,https://kin.naver.com/qna/detail.naver?d1id=8&dirId=80511&docId=491676569&qb=6rOg7JaR7J20&enc=utf8
고양이 임신,"저희 집 마당에 자주 오는 길고양이가 있는데, 엄청 애교도 많고 순둥한 고양이예요 그런데 얼마 전부터(아마 1월 중후반쯤) 사료를 많이 먹어서 처음에는 똥배인 줄 알았는데, 배가 조금씩 나오더니 지금은 많이 부풀어 있어요ㅠㅠ젖꼭지는 많이 나오지는 않았는데 임신이 맞는지 확인해 주세요아직까진 밥도 잘 먹고 배 만져보면 피하지도않고 막 딱딱하거나 출렁거리지도 않아요그리고 아마 똥배로 착각했을 때 재채기를 하고 콧물도 조금씩 났던 걸 보면 허피스에도 걸렸던 것 같아요(지금은 괜찮아요)요즘에는 저희 집 안으로 들어오고 싶어 하던데, 새끼를 낳을 때가 돼서 그런 걸까요?",https://kin.naver.com/qna/detail.naver?d1id=8&dirId=80511&docId=492329757&qb=6rOg7JaR7J20&enc=utf8
고양이 배에 상처,고양이 배에 젖꼭지가 떨어져서 피가 난 것같은데 저번에도 고양이가 냉장고 같은 높은곳에 올라가다 이런적이있어서 그냥 뒀어요 근데 점점 주변 털이 빠지고 상처가 더 커지는 것 같아서 어케해야 하는지 모르겠어요 고양이가 핥아서 상처가 더 심해지는 것 같고 약이나 소독이런건 어떤걸로 해야하는게 좋은지 모르겠습니다,https://kin.naver.com/qna/detail.naver?d1id=7&dirId=70122&docId=489763158&qb=6rOg7JaR7J20&enc=utf8
고양이 방에 가두면 안되나요,안녕하세용 저희 가족은 고양이 3마리를 키우고잇습니다 저희 가족은 밤에만 고양이를 고양이방에 가두는데요 ㅜㅜ 그 이유가 부모님이 고양이 털을 무지무지 싫어하시고 아예 혐오하시는 편이여서… 고양이는 좋아하시는데 털이 싫으시대요.. 그래서 낮에는 고양이 방을 열어줘서 고양이들이 거실이나 방을 자유롭게 쓸 수 있게하는데 문제점은 밤이되면 저희가 자러 들어가는데 그럼 엄마아빠가 고양이를 무조건 고양이방에 다 가둬나요.. 고양이들이 맨날 문 열어 달라고 긁고 야옹거리는게 무척 마음에 걸립니더 ㅜㅜ 그래서 부모님께 말씀 드렸더니 그럴거면 네가 나가서 집 자취해서 고양이 데려가라 하시는데.. 전 아직 이제 고등학교 올라가는 여학생입니다..^^ 고양이가 너무 스트레스 받아하는데 엄마아빠는 딱히 별 관심 없느것같아요.. 어떡하죠 ㅜㅜ 이러다 고양이들 우울증 올거같아요..,https://kin.naver.com/qna/detail.naver?d1id=8&dirId=80502&docId=492205637&qb=6rOg7JaR7J20&enc=utf8
고양이 설사 (사진주의),고양이가 설사 하는건 처음봐서요 갑자기 큰 방구 소리가 나서 가서 봤는데 이런 물똥같은 느낌에 설사를 한거같아서 제가 전에도 청소 할때 이런 느낌에 물똥이 있었던거 같은데 이번에 결막염이 있어서 그런건지 모르겠는데 병원을 가봐야 할까요? ㅠ,https://kin.naver.com/qna/detail.naver?d1id=8&dirId=80511&docId=490659665&qb=6rOg7JaR7J20&enc=utf8
고양이가 자꾸 토해요,올해로 고양이가 7살인데 자꾸 사료토를 해요. 몇 년 전에도 사료토를 했었어서 그냥 급하게 먹었나 보다 하고 넘겼는데 올해 유독 많이 하네요. 그래서 츄르 비슷하게 생긴 영양제를 먹였는데 그 뒤로 토를 안 했단 말이에요. 그래서 안심했는데 오늘 또 토를 하네요. 이거 병원 데리고 가야겠죠? 부모님이 주말에도 회사에 가셔서 학생인 제가 병원 데리고 가야 하는데 다음 주가 시험이라 당장은 못 가거든요. 그 잠깐 사이에 갑자기 확 아파지는 건 아니겠죠?ㅜㅜ 너무 걱정돼요,https://kin.naver.com/qna/detail.naver?d1id=8&dirId=80511&docId=490484079&qb=6rOg7JaR7J20&enc=utf8
새끼 고양이 죽이는 꿈,"어젯밤 꿈에 새끼 고양이 몇 마리를 반복적으로 제 실수로 죽이는 장면이 나타났어요. 계속 같은 구간에서 이불 속에 있는 고양이가 콤파스 같은 날카로운 물체에 의해 복부를 다쳐서 피를 흘리며 죽는 상황이었어요. 이 장면이 반복되었고, 다른 상황에서는 주차장에서 고양이가 뛰어가다가 차에 치여 죽는 경우도 있고.. 고양이가 죽으면 저는 바로 손으로 집어서 다시 살리려 하며 울면서 시간을 되돌리는 느낌이 들었고, 시간을 돌리면 또 같은 실수나 사고가 계속 일어나는 꿈이었어요.. 너무 기분 나쁜 꿈이라서 ㅠㅠ 대체 무슨 꿈인가요? 고양이 색깔이 하얀색? 약간 갈색? 이렇게 기억나요. 새끼 고양이도 있었고 큰 고양이도 나왔었어요.. 잠깐 꿈 꾼거지만 너무 기분나빠서 당황스럽네요 ㅠㅠ",https://kin.naver.com/qna/detail.naver?d1id=3&dirId=31505&docId=492128490&qb=6rOg7JaR7J20&enc=utf8
고양이 손톱 옆에 혹?,고양이 손톱 잘라주다가 발견했는데작게 혹?같은 살?이 달랑거리는데뭔가요…?어떻게하면 생겨나는건가요?,https://kin.naver.com/qna/detail.naver?d1id=8&dirId=80511&docId=491822033&qb=6rOg7JaR7J20&enc=utf8
"20살 고양이 폐종양,췌장염,신부전,심비대에 답변부탁드립니다...피하수액도요",20살 고양이이고 검사결과 폐에종양이 발견되었습니다 전이는 불명확하고 일단 한쪽폐에 암이있어요 얼마전에 재채기하는데 피가 나오길래 이상하다 했는데 이것이 원인이었습니다...그리고 최근에 갑자기 악화되어 병원에 결국 검사하러갔는데 너무나도 얌전히 검사를 받았습니다..원래 저희 고양이는 집밖에서는 너무 사나워서 검사같은거 꿈에도 못꿧는데 그만큼 기운이 없다는뜻이겠죠... 그래서 폐암도 진단받은것이고지금 상태가 이런데 동물병원에서는 워낙 나이도 많고해서 더이상 해줄수 있는것이 없다고합니다...현재 고양이가 복용중인약은 종양억제+스테로이드 하루2회먹는 약 뿐이고 추가로 수액처치를 췌장수치에 도움이 될수있다고 하는데 병원에 가는걸 극도로 싫어하니 집에서 현재 2회피하수액을 하였는데 고양이가 너무 힘들어하고 아파합니다 제 욕심일까요? 그냥 이대로 아파하는거 먹는약 가지고만 컨트롤 해야할까요?? 조언부탁드립니다...,https://kin.naver.com/qna/detail.naver?d1id=8&dirId=80511&docId=492487540&qb=6rOg7JaR7J20&enc=utf8
고양이털 알레르기?,지난 토요일에 고양이 두마리가 있는 카페에 다녀왔습니다. 고양이가 새끼 낳았대서 새끼고양이 만지고 그 카페에 한 1시간 정도 있었는데그날 이후로 계속 피부가 가려워요. 두드러기처럼 발진?이 생겼다 가라앉고 반복 중입니다.다른 증상은 없고 피부만 전신이 가려워요..ㅠㅠ한 2시간에 한번씩 부위를 가리지않고 울긋불긋 두드러기 올라옵니다.잘못먹은 음식은 없습니다.1. 원래 고양이털? 침? 알레르기가 없었는데 갑자기 생길 수도 있나요?2. 그날 이후로 옷도 세탁하고 씻기도 했는데 아직도 가려우면 다른 이유가 있는걸까요?,https://kin.naver.com/qna/detail.naver?d1id=7&dirId=70111&docId=487108378&qb=6rOg7JaR7J20&enc=utf8
고양이가 발등 깨무는 이유,"저희집고양이가 예전엔 안그랬는데 요즘에 서있으면 발등, 무릎을 깨물어요 쎄게는 아니고 약하게 앙 깨무는데 왜 그러는걸까요?? 자주그래요",https://kin.naver.com/qna/detail.naver?d1id=7&dirId=70108&docId=487816019&qb=6rOg7JaR7J20&enc=utf8
고양이 젤리에 이거 뭐죠,고양이 발바닥 젤리에 굳은 살 마냥 이거 뭔가요잘라주고 싶은데 그래도 되는건가요다른 발에는 없고 딱 여기 두 군데만 있어요엄지랑 검지라도 해야하나 여튼꼬집어도 아무 반응 없는거 보면 안픈건 아닌거 같은데손톱 깎이 같은걸로 잘라도 되는건가요 걍 냅둘까요,https://kin.naver.com/qna/detail.naver?d1id=8&dirId=80511&docId=492124621&qb=6rOg7JaR7J20&enc=utf8
고양이 구토 증상,고양이가 컨디션도 좋고 간식도 잘먹고 사료는 소량 먹는데 ..구토증상이 잇네요 대변도 거즘 하루에 한번 아니면 안할때도 잇고 이유가 멀까요 병원을 가야되는지.. 가면 비용도 많이 발생되고 지켜봐야되는지 이번에 유산균 구매하기는.햇는데,https://kin.naver.com/qna/detail.naver?d1id=8&dirId=80511&docId=490555548&qb=6rOg7JaR7J20&enc=utf8
동물병원 고양이 발톱 빠짐,고양이 방광염 수술로 동물병원 갔는데 거기서 처치 과정에서 고양이가 많이 겁 먹어서 반항하다가 뒷발 오른발 한쪽엔 발톱이 두개가 빠지고 왼발에는 발톱한개서 피가 많이 나게 되었습니다 입원 하루 후 집에 데리고 갈 때는 개구호흡이 심해서 빨리 데리고 가지 못했네요 원래 병원에서 고양이가 많이 움직여서 발톱이빠지눈 경우가 있나요? 저번에 같은 시술로 다른 병원에 갔을 때에는 이런 적도 없었고 개구호흡도 하지 않았습니다,https://kin.naver.com/qna/detail.naver?d1id=8&dirId=80511&docId=489128997&qb=6rOg7JaR7J20&enc=utf8
사람감기 고양이에게 옮나요?,사람감기 고양이에게 옮나요?? 어제부터 감기기운이 있어서 집에서도 마스크끼고 우리집 고양이한테 뽀뽀도못하고있어요... 제 감기 고양이에게 옮을가봐..네이버엔 고양이감기가 사람한테 옮는지에 대한 답변만 있네요고양이 감기가 나한테 옮는거쯤은 아무렇지않은데...,https://kin.naver.com/qna/detail.naver?d1id=8&dirId=80511&docId=479973760&qb=6rOg7JaR7J20&enc=utf8
키우는고양이가 할퀴었어요,집에서 키우는고양이가 할쿡었어요.침대에있는애를 꺼내려다가요.;ㅠ오늘 병원에가서 주사맞고 약먹었는데 지금도 열감이 있고 아푸네요.ㅠ혹시 파상풍일까요?아니 광견병일까요?내일 다시 염증주사 또 맞으면 괜찬아질까요?:솔직 진짜 걱정이 많이 되네요.,https://kin.naver.com/qna/detail.naver?d1id=7&dirId=7010107&docId=489199869&qb=6rOg7JaR7J20&enc=utf8
고양이 뒷다리 털빠짐,고양이 뒷다리에 저렇게 털이 빠진건지 살이 까진건지 … 잘 모르겠는데 원인이나 증상이 뭔지 알고계신 분 있으실까요? (Ai답변 삭제합니다. ),https://kin.naver.com/qna/detail.naver?d1id=8&dirId=80511&docId=491963536&qb=6rOg7JaR7J20&enc=utf8
고양이가 이상해요,어젯밤에 고양이가 잠만 계속 자고 밥도 안 먹고 간식도 안 먹고 가까이만 가도 화내고 그러길래 병원에 데려갔는데 병원에서 진정제를 맞췄거든요? 근데 집에 온 후부터 애가 입도 못 다물고 침 계속 흘리고 병원에서 검사하면서 혀를 씹어서 그런건지 츄르도 못 먹고 피검사해서 테이프 붙인 거 떼려고 했는데 몸도 못 만지게 하고 계속 화내요 너무 무서워요 걱정돼서 미치겠어요 자고 일어나면 좀 괜찮아질 줄 알았는데 그대로예요 입도 못 다물고 아예 입을 못 움직이는 것 같아요 눈도 계속 풀려있고 너무 아파보여요 멀쩡한데 병원 괜히 데리고 간 건가 싶기도하고 너무 무서워요 걱정돼요 고양이 두 마리를 키우는데 다른 한 마리도 얘가 이상한지 눈 동공확장되고 기어다니면서 냄새맡았는데 얘는 계속 호랑이소리 내고 화내요 이거 괜찮은 거 맞아요? 병원 또 데려가야하면 어떡해요? 너무 미안해요,https://kin.naver.com/qna/detail.naver?d1id=8&dirId=80511&docId=492396078&qb=6rOg7JaR7J20&enc=utf8
고양이 상처,"제가 일이 끝나고 와보니,저희집 고양이 등에 땜빵이 나버렸어요 피도 나는거 같고ㅠㅠ막 물 같은 것도 나요 지금 시간이 늦어서 병원에 못가서,소독만 했는데 이거 어떻게 하죠? ㅜㅠ",https://kin.naver.com/qna/detail.naver?d1id=8&dirId=80511&docId=491497957&qb=6rOg7JaR7J20&enc=utf8
새끼고양이 구토 설사,어제 새끼 길고양이 두 마리를 구조해서 데리고 왔거든요근데 두 마리 다 설사를 하고 있는데 한 마리는 상태 자체가 안 좋고 설사도 많이해서 결국 오늘 고양이 별로 갔습니다근데 남은 한 마리도 설사를 하긴 하지만 움직임도 많고 밥도 어느정도 먹고 있습니다병원에서 처방 받은 약을 먹고는 있지만 아직 이틀째이긴 하지만 밥을 먹기만 하면 바로 설사해서 너무 걱정입니다고양이 별로 떠난 친구는 혈변도 해서 범백혈구감소증 검사도 했는데 범백은 아니라고 해서 다른 고양이도 범백은 아닌 것 같습니다현재 로얄캐닌 베이비캣 사료를 먹이고 있는데 혹시 사료 말고 습식을 먹여도 될까요?습식을 먹고 설사를 더 하진 않겠죠?태어난지는 한달 반 정도 됐습니다,https://kin.naver.com/qna/detail.naver?d1id=8&dirId=80511&docId=489853021&qb=6rOg7JaR7J20&enc=utf8
고양이 입주변에 염증이라고 해야할지…?,고양이 입 턱쪽에 이렇게 뭐 고름이 차있는 건지 뭐가 차있는 건지 모르겠는데 소독해주면 괜찮을까요? 무슨 종 같은 건 아니겠죠?,https://kin.naver.com/qna/detail.naver?d1id=8&dirId=80511&docId=492378008&qb=6rOg7JaR7J20&enc=utf8
3개월 애기고양이 양치,3개월 된 애기 고양이 양치해야 하나요? 네이버를 찾아보니 츄르나 츄르 없이 칫솔에 익숙해지게만 한번씩 입에 대주기만 해줘도 된다는데 맞나요?,https://kin.naver.com/qna/detail.naver?d1id=7&dirId=70203&docId=491023389&qb=6rOg7JaR7J20&enc=utf8
고양이 캣휠 사주면 잘 타나요?,살짝 뚱뚱해진 것 같아서 운동겸 다이어트 시키려고 캣휠 사주려고 하는데 고양이들 잘 타나요? 저번에 캣타워를 사줬는데 캣타워는 안올라가더라고요ㅠ,https://kin.naver.com/qna/detail.naver?d1id=8&dirId=80502&docId=492127290&qb=6rOg7JaR7J20&enc=utf8
고양이 결막염인가요?,"고양이가 눈 한 쪽을 제대로 못뜨고 다녀서 자세히 봤는데 왼쪽 눈 앞이 약간 다래끼처럼 뭐가 올라온 거 같고 눈꼽도 계속 껴있고요 또, 눈가가 빨갛더라고요 원래같으면 한 두시간 내에 다시 돌아오던데 이번에는 좀 심각한 거 같아요 그리고 혀로 자꾸 코를 반복적으로 핥고 코딱지도 요즘엔 자주 생기는 거 같았어요 그리고 오후 5시경에 헤어볼 토도 했어요이럴 때 병원 가야되지만 제가 위에서 언급한 증상들은 어떤 질병을 앓고 있는 건가요..? 아침부터 한참 저래서 너무 걱정돼요..",https://kin.naver.com/qna/detail.naver?d1id=8&dirId=80511&docId=491854636&qb=6rOg7JaR7J20&enc=utf8
컬러렌즈 끼면 고양이 눈 됨,컬러렌즈를 끼면 눈의 굴곡이 다른 사람들 표준 정도랑 다른지 계속 아래로 내려와서 고양이 눈처럼 세로로 길어지는데 왜 그런 건가요? ㅠㅠ,https://kin.naver.com/qna/detail.naver?d1id=7&dirId=70112&docId=490343498&qb=6rOg7JaR7J20&enc=utf8
오이이아이 고양이 팝업,안녕하세요 저랑 친한 친구가 오이이아이 고양이를 너무 좋아해서요 혹시 오이이아이 고양이 팝업 스토어나 오이이아이 고양이로 장식 된 공간이 없을까요? 저도 오이이아이 고양이를 보면서 오이이아이 고양이 소리를 듣고 싶네요 부탁드려요 꼭꼭 좀 알려주세요 꼭이요,https://kin.naver.com/qna/detail.naver?d1id=8&dirId=80502&docId=490820075&qb=6rOg7JaR7J20&enc=utf8
당뇨 고양이에게 좋은 음식,고양이가 당뇨인데간식없이 처방용 습식만 주기에는 불쌍해서 간식같은걸 만들어보려고 하는데 혈당 안오르고 고양이에게 좋은 음식이 있을까요?연어나 닭가슴살은 괜찮을까요?,https://kin.naver.com/qna/detail.naver?d1id=7&dirId=7010106&docId=463730300&qb=6rOg7JaR7J20&enc=utf8
고양이 송곳니 옆 투명한 물집? 수포?,저희집 고양이 구강염 약 발라주다 발견했는데송곳니 옆 흰색(약간 투명) 볼록한 부분이 생긴 것 같아요사진상 보이듯 양쪽 같은 부분에 생긴 것 같은데원래 있었는데 못 본건지 잘 모르겠어요원래 있었다면 확인을 했을 법 한데저게 뭘까요? 병원에 가봐야 할까요?,https://kin.naver.com/qna/detail.naver?d1id=8&dirId=80511&docId=492206970&qb=6rOg7JaR7J20&enc=utf8
고양이가 기침하고 잠만 자요,5개월 된 고양이인데 30분에 한두번씩 기침하고 며칠 전부터 잠만자요 밥은 똑같이 잘 먹고 잘 싸고 잘 노는데 감기인가 싶어 걱정 돼서요,https://kin.naver.com/qna/detail.naver?d1id=8&dirId=80511&docId=491432744&qb=6rOg7JaR7J20&enc=utf8
고양이 코로나바이러스 장염,"저희집에 11개월 된 랙돌 고양이가 설사와 투명? 흰색 털 토?해서 병원에 가보니 변 검사 했을때 코로나바이러스만 양성으로 떴어요 ㅠ 그래서 약 처방 받아왔는데 병원쪽에선 2-3일동안은 설사를 할거고, 애기가 너무 무기력하고 상태가 더 안좋아지면 수액 맞으면서 입원치료 해야된다고 하더라구요1월30일 토요일 저녁부터 약 먹이고 있고 2월2일 오전 5시까지 묽은 설사를 총 5-6번 했어요 구토는 아예 안하구요 흠 물도 먹고 밥도 조금씩이라도 먹고 살짝 뛰어놀기는 하는데 그래도 평소보다 힘이 없어보이는건 어쩔 수 없는거 같아요 차라리 애기가 더 아프지 않게 입원치료를 하는게 맞을까요? 입원하면 스트레스 받을 거 같은데 ㅜㅜ",https://kin.naver.com/qna/detail.naver?d1id=8&dirId=80511&docId=491715618&qb=6rOg7JaR7J20&enc=utf8
고양이 이빨,"저희 집 고양이가 아빨이 안좋아서 병원에 가서 이빨을 다 빼야 된대요그러면 우리 고양이는 사료를 어떻게 먹나요??아니면 따로 바꿔 줘야할 사료나 편하게 먹을 사료,주의 해야 할 점 등 알려주세요전문가 답변을 원해요",https://kin.naver.com/qna/detail.naver?d1id=8&dirId=80511&docId=488492780&qb=6rOg7JaR7J20&enc=utf8
고양이 턱에 검정색 턱드름?,고양이 턱에 턱드름이 있는데 이걸 전용 턱드름 빗으로 긁어주면 되나요? 안긁어 주는것 보단 나은건가요? 심하거나 방치하면 어떻게 되는건가요?알려주세요,https://kin.naver.com/qna/detail.naver?d1id=8&dirId=80511&docId=491695572&qb=6rOg7JaR7J20&enc=utf8
"고양이 분양 후 중증 질병 발생, 치료비 보상 가능할까?","2026년 2월 24일 네이버 카페를 통해 오픈채팅으로 펫샵에서 고양이를 비대면 분양받았습니다.분양 전 1차 예방접종·원구충 3회·3대 질병 키트 완료 안내 받았고, 건강한 고양이만 분양한다고 여러 차례 확인했습니다.3월 7일 저녁부터 기운 없음, 식사량 감소, 배 불룩, 호흡 곤란 증상 발생하였고,3월 8일 병원 엑스레이에서 복수·복막염 의심, 재검사 결과 원인 미상의 패혈증 진단.주요 증상: 저체온, 빈혈, 황달, 활력 저하, 혈액학적 이상.치료: 체온 조절, 항생제, 수액, 알부민 수혈, 산소 케이지 입원 중입니다.최초 병원방문 상황 펫샵 알림 후 대응 “본사 확인 완료후 수원으로 인도해 입원 진행” 안내하여, 진료 중단, 귀가 후 통화에서 “복막염은 질병이 아니며 보호자 책임”으로 번복하였습니다.분양비 45만 원 계좌이체, 인도비 10만 원 현금결제, 진료·치료비 90만 원 카드결제,입원 지속 시 일일 30~40만 원 추가 예상입니다.계약서상 “분양 후 15일 이내 고양이 질병 발생 시” 관련 제외 조항은 없으며,협력병원 외 진료 진행 사유는 증상 위급 및 펫샵 안내 번복입니다.분양 후 단기간 내 중증 질병 발생으로 치료비 보상 및 환불 가능 여부,향후 분쟁 조정 및 권리 보호 절차 검토를 요청드립니다.카페글, 카톡, 계약서, 문자, 엑스레이사진, 진단서, 영수증 모두 보관 중입니다.감사합니다.  관련태그: 손해배상, 계약일반/매매",https://kin.naver.com/qna/detail.naver?d1id=6&dirId=60215&docId=492386124&qb=6rOg7JaR7J20&enc=utf8
고양이 사료 추천,저희 고양이는 식탐이 많고 사료도 잘 안가리는 편입니다 하림 밥이보약 보라색 먹이다가 최근에 금전적인 문제로 캐츠랑 리브레로 잠시 바꿨는데 먹여도 괜찮은걸까요?더 안전하고 오래살수있는 좋은걸 먹이고 싶은데 가성비 좋은 사료 추천 부탁드려요ㅠㅠ(2달정도 시기만 지나가면 비싸더라도 다시 좋은 원료의 사료 로 먹일 예정입니다 비싸더라도 좋은 원료인 사료도 추천 부 탁드려요!!)*아래 사진 참고고양이 종•나이•급여중인 사료 체크 가능@@@@@ 광고 사절입니다 @@@@@⚠️⚠️⚠️ 광고 신고합니다 ⚠️⚠️⚠️,https://kin.naver.com/qna/detail.naver?d1id=8&dirId=80511&docId=492351209&qb=6rOg7JaR7J20&enc=utf8
샴고양이 식욕부진 증상,샴고양이가 추위를 타는가싶더니 오늘와서보니 먹지도 않고 울지도 않고 배로 숨쉬는게 크게 느껴집니다. 나이가 7살정도인데 여아이고 무슨문제일까요.아픈거같은데 계속 엎드려있거나 웅크리고있어요.혹시 아실분 있나요?,https://kin.naver.com/qna/detail.naver?d1id=8&dirId=80511&docId=489971402&qb=6rOg7JaR7J20&enc=utf8
고양이 피토 질문합니다 ㅠㅠ,저희집 고양이가 딱 일주일 전장난감 낚시대 줄을 먹었었어요.. 놀라서 곧장 병원에 갔는데 배를 절개하거나 토를 유도해서 빼내야 한댔는데 다행히 토를 유도해서 토로 나왔어요 (첫번째 사진 참고) 근데 그 후부터 애가 사료 먹는 양도 줄고 어제는 딱한번 부어주고 지금까지 다 먹지도 않네요..그리고 방에 가보니 피토를 했어요 어제는 일반 토 같은토를 두번 했고 오늘 피토가 있네요.. 이거 무슨일일까요 병원에서 며칠 토를 할수있다고는 했는데 일주일이되었고 애가 살도 0.2빠졌네요,https://kin.naver.com/qna/detail.naver?d1id=8&dirId=80511&docId=491969954&qb=6rOg7JaR7J20&enc=utf8
암컷 고양이 중성화 수술,고양이 중성화 수술한지 오늘이 2일차인데요 녹는실로 했고 넥카라는 언제까지 해줘야할까요?? 그리고 고양이가 잘때도 넥카라는 계속 해줘야하는거죠?,https://kin.naver.com/qna/detail.naver?d1id=8&dirId=80502&docId=492467350&qb=6rOg7JaR7J20&enc=utf8
고양이 새끼 꿈,눈이 쌓인 공원같은곳에고양이새끼가 몇마리가 있었다 3마리쯤이유는 모르는데 그 공원 구석이 내가 생활하는곳같았다공원 다른곳에서 추가로 고양이 새끼가 있었는데더 많았고 10마리가 넘는듯했다그옆에 어미 고양이가 죽어있었다난 평소에 고양이를 그닥 좋아하지도 않는데새끼들을 보니 기뻤다꿈 해몽 부탁해요,https://kin.naver.com/qna/detail.naver?d1id=3&dirId=31505&docId=491390568&qb=6rOg7JaR7J20&enc=utf8
고양이 송곳니 하나가 안나요,12개월 된 브리티쉬숏헤어입니다. 송곳니 하나가 안나요다른 고양이들 대비 전체적으로 치아가 작은 것 같기도 해서 성장이 느린건가 싶었는데 앞 왼쪽 송곳니는 날 기미조차 안보여요몇 개월 전까지 입술에 염증이 있었는데 그 영향이 있었을까요...사진 상 보기에 현재 치아 성장과 입 속 상태 정상인가요?병원 방문 전 어느정도 확인하고 싶어 올립니다 걱정이 돼서요ㅠㅠ,https://kin.naver.com/qna/detail.naver?d1id=8&dirId=80511&docId=490837093&qb=6rOg7JaR7J20&enc=utf8
