title,content,href
고양이 두마리 왜 그럴까요,"제가 고양이 한마리를 길에서 주워왔습니다 중성화도 했고(수컷) 나이는 이제 곧 8개월 됩니다 그러고 한달뒤에 파양당한 고양이를 데리고왔어요 나이는 3살이더라구여 중성화도 됐어요(암컷) 근데 우리 8개월된 애가 자꾸 요번에 3살 에 목덜이도 물고 뒷발도 물고,,자꾸 너무 장난이 심해요,,(혹시 중성화가 됐는데 발정기가 올수 있을까요?) 매번 우리 3살짜리가 하악질을 연속으로 5번도 하고 매번 으어어ㅓ엉구너ㅓㄱ억억 이런소리가 정말 일상입니다 어떻게 해야 될까요 제발 알려주세요",https://kin.naver.com/qna/detail.naver?d1id=8&dirId=80511&docId=492430975&qb=6rOg7JaR7J20&enc=utf8
암컷 고양이 중성화,저희 집에 고양이 2마리를 데리고 살고 있는데 수컷은 중성화 시킨 상태고 암컷 고양이는 아직 안한 상태인데 데려온지 5년 좀 넘어가지고 계속 배변 실수를 집안 곳곳에 저질러서 얼른 중성화를 시켜야하는데 부모님이 비용이 너무 부담된다고 계속 그냥 방치식으로 대하고 있어서 제가 내년에 성인이 되서 돈 벌어서 어떻게든 시킬려하고 있는데 아무리봐도 너무 늦게 시킨다고 생각이 들어서 이 정도로 늦게하면 건강에 큰 이상이 있을까요?,https://kin.naver.com/qna/detail.naver?d1id=8&dirId=80511&docId=491775588&qb=6rOg7JaR7J20&enc=utf8
"고양이 링웜 환불 소송, 법적 대응 가능할까요?","3월 8일 펫샵에서 고양이를 분양 받았습니다.아기 피부가 이상해서 물어보니 간단한 피부염이라는 안내를 받았고, 병원에 가서 1-2주간 처방받은 연고만 발라주면 금방 낫는다고 했습니다.(계약서에 피부염이라고 적혀있고 치료요망에 체크되어있음)3월 9일, 고양이를 데리고 동물병원에 가니 단순 피부염이라고 소개받은 병변이 링웜에 의한것이라는 소견을 받았습니다. 사람에게도 옮고 재발이 잦아 치료가 힘들다는 말을 듣고 바로 펫샵에 전화하여 항의했고, 펫샵은 피부염이라고 고지했으니 상관 없다고 주장합니다.그냥 저의 개인적인 생각과 주장은 고양이 피부염의 종류가 링웜만 있는것도 아니고, 사람에게 옮지 않는 피부염도 있는데 사람에게 옮을수도 있다는 특수성이 있다면 분양시 정확하게 고지를 해줬어야 한다고 생각하기 때문에 단순 피부염이라는 고지는 저를 기망하고 속인것이라 생각하고, 환불을 받고싶은 입장입니다.관련 판례가 없어서 혼자 판단하기가 너무 힘든데현재 상황에서 환불이 과한 요구일까요?환불 요청에 고소를 하든 소송을 하든 알아서 하라는 식으로 나오니까 진짜 어떻게든 소송 걸어서 해결하고싶은데…증거는 계약당시의 녹음내용은 없고 이후 전화할때 녹음한 것에서 분양당시 단순 피부염이라고만 말한것을 확인할 수 있는 대화내용만 있습니다.관련 법조항과 현재 상황에 소송으로 대처하는 것이 적절한지 조언부탁드립니다.  관련태그: 소송/집행절차, 소비자/공정거래",https://kin.naver.com/qna/detail.naver?d1id=6&dirId=60215&docId=492437881&qb=6rOg7JaR7J20&enc=utf8
"고양이 영화, 처음 접하는 사람에게 추천할 만한 작품이 있나요?","고양이 영화를 처음 접하는 친구에게 추천해주고 싶은 작품이 있다면 어떤 게 있을까요? 너무 무겁지 않으면서도 고양이의 매력을 잘 느낄 수 있는 영화로, 힐링이 필요할 때 가볍게 볼 수 있는 작품을 찾고 있습니다. 혹시 최근에 본 영화 중에서 이런 조건에 맞는 영화가 있다면, 그 영화의 특징이나 장점을 알려주시면 도움이 될 것 같습니다. 고양이의 사랑스러움이 잘 드러나는 장면이나, 영화가 주는 따뜻한 메시지도 함께 공유해주세요.",https://kin.naver.com/qna/detail.naver?d1id=3&dirId=30303&docId=492399601&qb=6rOg7JaR7J20&enc=utf8
고양이 중성화 후 예민함,오늘 암컷고양이가 중성화 수술을 했는데집에 오고 나서 엄청 예민해졌어요.평소에 애교쟁이에다가 순한 아이인데 수술하고 오니 경계를 심하게 하고 혼자 성질내고 하악질도 해요ㅜㅡㅜ같이 살던 수컷고양이는 중성화수술 해도 평소와 다름없었는데 암컷은 원래 다른 걸까요?,https://kin.naver.com/qna/detail.naver?d1id=8&dirId=80511&docId=492470778&qb=6rOg7JaR7J20&enc=utf8
비염이 있으면 고양이를 못키우나요,제가 알레르기성 비염이 있는데(정확히는 집먼지진드기가 원인) 비염이 있으면 고양이를 키우는 걸 추천하지 않는다는 소리가 있는데 진짜인가요,https://kin.naver.com/qna/detail.naver?d1id=7&dirId=70102&docId=491713567&qb=6rOg7JaR7J20&enc=utf8
고양이알러지있는것같은데,고양이랑 같이 있으니까눈 충혈되고 간지럽고 목이 좀 붓더라고요목 부은 건 좀 거슬리는 정도인데눈은 진짜 엄청 빨개지고 너무 간지러워서;약국에서 가려움 충혈 완화하는 안약만 사도 될까요?눈 안쪽도 좀 붓는 것 같은데안과 가는게 좋을까요?,https://kin.naver.com/qna/detail.naver?d1id=7&dirId=70401&docId=491922038&qb=6rOg7JaR7J20&enc=utf8
고양이 링웜이 사람 귀에도 옮나요?,"저희집 고양이가 링웜에 걸려 치료한지 한두달쯤 저희아이 한쪽 귀에 이상반응이 생겼습니다붉은 피부에 각질 , 가려움증으로 피부과를 갔고 단순 습진이라 해서 치료받았습니다(고양이 이야기는 안함)1~2주 약먹으면 좋아지다가 끊고 일주일 정도 지나면 다시 생겨서 그때마다 계속 피부과를 다니고 있는데 이제는 만성지루피부염이라고 했다네요다시 생길때는 작게 시작해서 번지듯이 커집니다타온약을 보면 항진균제, 스테로이드제, 면역억제제 해서 4알정도 이고바르는 약도 항진균제와 스테로이드제가 들어간약입니다제가 궁금한건 링웜이 귀에도 생길수 있나? 하는것과 진균검사를 해보고 싶은데 치료중 해도되는지.. 링웜 치료는 병변부위가 좋아지고 대략 얼마나 더 치료해야 완치되는건지 궁금합니다.시기가 겹친거와 반복적인 재발에 만의하나 있을수 있는 가능성까지 알아봅니다 ㅜㅜ",https://kin.naver.com/qna/detail.naver?d1id=7&dirId=70111&docId=491712989&qb=6rOg7JaR7J20&enc=utf8
처방전 없이 고양이 털 알레르기 약을 살수있나요?,제가 당장 내일 고양이집을 가는데 고양이 털 알레르기가 있어서 약을 사야하는데 처방전 없이 살수있나요? 어떻게 약사님에게 말을 해야할까요? 어떤약을 받아야할까요?,https://kin.naver.com/qna/detail.naver?d1id=7&dirId=70401&docId=492038980&qb=6rOg7JaR7J20&enc=utf8
고양이 물림,아침에 고양이에게 발등을 물려서 점심에 병원가서 파상풍항생제 주사를 맞고 집에 왔는데 쿵쿵 거려서 고양이가 놀래서 이번에는 팔을 쌔게 물려서 엄청 붓고 멍이 들었는데 또 병원가서 주사를 맞아야할까요?,https://kin.naver.com/qna/detail.naver?d1id=7&dirId=7010107&docId=492253491&qb=6rOg7JaR7J20&enc=utf8
고양이도 자폐가 있나요?,말 그대로 고양이도 자폐가 있나요? 아니 고양이 3마리 키우는 데 한 마리가 조금 특이해요. 뭔가 하는 행동도 고양이 같지 않고 좀 일반적인 고양이는 아닌 거 같아요. 그렇다고 자기 앞가림을 못하는 건 아닌데.. 사람도 자폐가 있으니 고양이도 있을까요?,https://kin.naver.com/qna/detail.naver?d1id=8&dirId=80502&docId=491649323&qb=6rOg7JaR7J20&enc=utf8
고양이 양치질 횟수,저희집 고양이 나이는 10살이구요  3~4살 때쯤 양치를 시도 하였으나 철저하게 거부당해 그래 하지마라 나중에 니만 고생이지뭐 하면서 냅뒀는데 최근 울집냥이 에게 입냄새가 심해서 혹시나해서 입을 벌려 어금니를 보니 치석이 잇몸과 치아 경계부분에 살짝 치석  있는게 보이더라구요그래서 다시 치석 제거용 고양이 칫솔을 사서 2일 전부터 양치를 시작하였고 처음은 살짝 거부 하다가도 옛날과 다르게 지도 치석때문에 불편한지 옛날처럼 과하게 거부는 안하고 살짝 하기 싫어하는 행동을 하면서도 받아 들이더군요 본론으로 말하자면 치석이 살짝 보여서 그러던데 요세 치석용 고양이 칫솔 몇주 쓰게 되면 종종 치석이 떨어져 나가는 경우를 봤다는 후기들이 많더라구요 그래서 전 치석때문에 아침식사후  저녁식사후 하루 2회 칫솔질 해주는데 하루 2회는 과한가요?꼭 1회 해야하는지 궁금 합니다.참고로 뭐 당연 병원가라고 말씀하시는데 사실 지금 고양이는 돌아가신 할머니께서 키우시던 고양이고 어찌하다보니 제가 떠안은 상황입니다 사실 제가 동물 대리고 병원갈 금전적 여유가 되질 않습니다 이점 참고해주시기 바랍니다 답변은 가급적 이분야 전문가 에게 듣고 싶습니다.,https://kin.naver.com/qna/detail.naver?d1id=7&dirId=70205&docId=492151404&qb=6rOg7JaR7J20&enc=utf8
고양이 알레르기 어떻게 해야 할까요?,"안녕하세요 저는 집에서 고양이를 3년째 키우고 있습니다그치만 키우던 도중에 고양이 알레르기가 생겼습니다.눈이 계속 간지럽거나 비염, 코막힘 등 반응이 나타납니다 일상생활 하기 좀 불편한데 어떤 방법으로 조치를 해야 될까요.. 특히 눈이 간지러운 증상이 제일 심합니다 비염이나 코막힘은 해결이 쉽게 되는데 눈 간지러움은 어떻게 조치해야 할까요 집에 있는것도 좀 버겁습니다..",https://kin.naver.com/qna/detail.naver?d1id=7&dirId=70306&docId=487215747&qb=6rOg7JaR7J20&enc=utf8
지인 고양이 병원비 소송 할 수 있나요?,"제가 3마리, 룸메가 1마리 데려와서룸메랑 같이 살면서 고양이 4마리를 키웠는데룸메가 군대 가면서 고양이를 맡기고 갔습니다(사실 사전 협의가 없었으니 맡긴게 아니라 두고 간 것)근데 저는 제가 데려온 것도 아니고 양육비 부담이 심해서 이야기 하다가 자기 고양이니까 제대할 때 데려갈거라 하더라고요그 동안 룸메 고양이한테 들어간 돈도 있고 하지만 같이 산 정이 있어서 지난 돈은 그냥 제가 부담하기로 마음 먹었는데 이번에 룸메 고양이가 원래 아파서 종종 병원 다니던 아이인데 응급상황이 생겨 약 20만원 정도 돈이 나갔습니다.응급 상황이었어서 놀란 저는 빠르게 병원 다녀오고 5일 정도 집에 붙어서 일도 쉬고 잠도 편히 못자며 간호했습니다.(넥카라 + 상태 때문에 혼자 밥,물을 못 먹고 약 때문에 24시간 간호가 필요했음)5일 정도가 지나 고양이가 어느 정도 회복했고이에 저는 응급 당시 상태랑 지금 회복한 상태, 어떤 상황이었고 얼마 나왔는지 청구서, 결제 내역을 전달하고 돈을 보태 달라 했습니다 (20만원 중 어려우면 절반만 달라했음)근데 원래 병원 종종 다녔는지 자기가 어떻게 아냐며 병원비도 5일 지나고 금액 청구했다고 돈을 못 주겠답니다..룸메 고양이는 원래 몸이 안 좋았어요키울 때도 별 관심이 없길래 제가 자주 병원 데려가줬었고.. 아무리 그래도 자기 고양이라면서 건강 상태도 몰랐다는 거잖아요?거기다 저는 이전 비용 달라고 한 적이 없고 이번 비용이 부담되니 반이라도 네 고양이 병원비 내달라니까 저렇게 말합니다..이젠 지쳐서 이번 병원비만이라도 받아내고 싶고 앞으로 제대 전까지 드는 비용 청구하고 싶은데 소송 가능할까요?받아낸 사례가 있을까요?",https://kin.naver.com/qna/detail.naver?d1id=6&dirId=60221&docId=490607931&qb=6rOg7JaR7J20&enc=utf8
고양이 발젤리쭙쭙,근데 고양이는 발젤리 쭙쭙이 왜하는건가요?? 애기들도 그렇고 성인 고양이들도 입에 물고 그러던데 왜그러나요?,https://kin.naver.com/qna/detail.naver?d1id=8&dirId=80511&docId=491797045&qb=6rOg7JaR7J20&enc=utf8
고양이 기침 소리가 이상해요,고양이가 자꾸 기침해요. 전부터 계속 재채기하고 그랬는데 갑자기 저 영상처럼 기침해요. 심장병이나 천식은 아니겠죠..? 지금 얼른 동물병원으로 데려가는게 나을까요?,https://kin.naver.com/qna/detail.naver?d1id=8&dirId=80511&docId=491493072&qb=6rOg7JaR7J20&enc=utf8
고양이 중성화 후 설사,고양이가 중성화를 하고난 뒤 갑자기 묽은 변을 눠요.사료 바꾼 거 없고 기생충 없고 특별한 거 준 적도 없는데혹시 항생제 때문일 수도 있나요?,https://kin.naver.com/qna/detail.naver?d1id=8&dirId=80511&docId=492101548&qb=6rOg7JaR7J20&enc=utf8
고양이한테 물렸어요,오늘 동생이랑 같이 고양이 카페에 갔는데요 가서 좀 놀거다 고양이가 제 동생을 물었어요 전체적으로 상처가 밑에 그림처럼 손바닥에 길고 깊게? 파여있었고 피는 약간 맺히듯이 났어요ㅠ 물린뒤에 사장님이 소독도 해주시고 연고도발라주시고 밴드도 붙여주셨다는데 괜찮을까요???ㅜㅠ 제가 걱정이 돼서 여쭤봤는데 고양이들 예방접종은 3차까지 다 했고 중성화수술도 했다고 하시네요ㅜ 동생한테 물어보니 약간 따끔거리는거빼곤 별다른 통증은 없데요 혹시 이거 광견병걸리고 그러면 어쩌죠???ㅠㅜㅠ 너무 걱정되네요ㅠㅠ 의사 선생님의 답변이 필요합니다ㅠㅠ참고로 고양이카페는 청결했고 고양이들도 관리가 잘 돼오있는것 같았어요,https://kin.naver.com/qna/detail.naver?d1id=8&dirId=80511&docId=492478090&qb=6rOg7JaR7J20&enc=utf8
고양이 알레르기,고양이를 너무 키우고 싶은데 제가 알레르기가 있어서요. 털이 덜 날리고 알레르기 반응이 비교적 적은 고양이가 있을까요?,https://kin.naver.com/qna/detail.naver?d1id=8&dirId=80511&docId=492472732&qb=6rOg7JaR7J20&enc=utf8
"고양이 분양 후 질병 발생, 치료비와 환불 가능할까?","안녕하세요.분당 소재 한 펫샵에서 렉돌 고양이를 분양(2026-02-16)받았습니다.펫샵에서 처음 데려올 당시에는 고양이의 상태에 이상이 없었고, 펫샵에서도 건강한 상태라고 하여 믿고 분양을 받았습니다.그런데, 집으로 데려온 후 2일 뒤(2026-02-18) 왼쪽 눈 옆에 원형 탈모가 발생해서 동물병원에 내원해보니 링웜(피부사상균증)으로 의심된다하여 검사를 진행했고, 검사결과를 2026년 3월 2일에 받았습니다.검사결과는 당연히 링웜 확정 판정이있습니다. 뿐만아니라, 2026년 2월 18일 병원 진료 시 귓속에 진드기도 다량 확인되어, 진드기 제거 및 치료까지 진행을 했구요.펫샵에는 2월 20일에 링웜으로 의심되는 상황과 귀진드기에 대해 고지를 하였으나, 병원치료로의 인계가 아닌 펫샵(분당 펫샵이 아닌 수원에 있는 분점으로 안내하였음)에 데려오면 연고를 주겠다는 안내를 받았습니다. 그리고 현재 고양이의 피부상태에 대해 사진도 공유했으나 대소롭지 않은 증상이라 답변하며 검사를 받을 필요도 없고 약만 발라주면된다는 답변으로 일관했습니다.해당 펫샵과는 더이상 대화를 하는게 무의미하다 판단해, 현재 처음 진료를 받았던 병원을 통해 지속 치료중에 있구요. 문제는 고양이를 치료하며 데리고 있는데, 최근(2026-03-07) 와이프의 몸에 링웜 증상까지 생겨 병원에 내원을 할 예정입니다.이 외에도, 펫샵에서 별도로 운영하는 의료 멤버십(동물병원 연계) 가입도 권유 받아 당일 가입(50만원)을 했었는데, 사실상 사용을 잘 안할 것 같아 10분후 환불 요청을 했음에도 환불규정상 환불이 불가능하다는 답변을 받아 이건 체념을 한 상황입니다.1. 이런 상황에서 고양이 치료비용, 보호자 치료비용 및 정신적 피해에 대해 구상권 청구를 할 수 있을까요?2. 최초 가입했던 멤버십을 사용도 하지 않은 10분 내에 환불요청을 했음에도 이행하지 않은 것에 대해 지금이라도 환불을 받을 수 있을까요?  관련태그: 손해배상, 소송/집행절차",https://kin.naver.com/qna/detail.naver?d1id=6&dirId=60215&docId=492357040&qb=6rOg7JaR7J20&enc=utf8
입술 고양이주름,"안녕하세요?60대초반인 여성입니다작년부터 윗입술에 세로주름이 눈에 띄기 시작하더니올 초반부턴 입술 움직이지않고 가만히 있어도 넘 선명하게 세로 주름이 심각하네요...ㅠ음식먹을때나 얘기할땐 더 도드라져보여 대인관계도 기피하게되네요ㅠ전 이 나이까지 담배는 아예 피운적이 없고빨대 사용도 손꼽힐 정도로 나쁜 습관도 없었는데,아직은 젊은 나이임에도 왜 윗입술 고양이 주름만 심각한건지...차라리 눈가나 다른 주름이면 차라리 신경 덜 쓰일텐데...사람 만나는것두 피하게되고자존감도 떨어지네요피부과에서 상담받고 효과 확실하다 해서 윗입술 라인에주사시술 3차례 받았는데전혀 달라진것도 없이 시간 지나니 더도드라져보이네요아...요즘 너무 우울해요ㅠ박피시술만이 답일까요?흉터 심하지않은 다른 방법은 없을까요?",https://kin.naver.com/qna/detail.naver?d1id=7&dirId=70103&docId=492278563&qb=6rOg7JaR7J20&enc=utf8
고양이가 백혈병에 걸렸는데 어케 대처해야하나요,고양이가 요즘에 밥도 안 먹고 우울해보여서 병원 가보니 백혈병이라더라고요 근데 고양이 백혈병은 다른 감염 고양이로부터 감염 되야 한다던데 백혈병 걸린 고양이는 6살 쯤 되는데3~4년 쯤에 집에 데리고 와서 키우고 있거든요 그리고 집에 다른 고양이 두마리도 키우고 있는데 그럼집에 있는 다른 두 마리중 하나한테 감염이 된 걸까요? 그리고 백혈병 걸린 고양이랑 안 걸린 고양이랑격리 조치를 해야할까요?,https://kin.naver.com/qna/detail.naver?d1id=7&dirId=7010104&docId=491533592&qb=6rOg7JaR7J20&enc=utf8
고양이 기침(소리있음) 뭔가요?,안녕하세요 고양이가 얼마 전부터 종종 이런 기침?소리를 내는데 혹시 천식이나 이런건 아니겠죠?영상 속 3번 들리는 이 소리입니다.,https://kin.naver.com/qna/detail.naver?d1id=8&dirId=80511&docId=491475408&qb=6rOg7JaR7J20&enc=utf8
암컷고양이 중성화 흉터?,어제 중성화했고 이제 1살 된 암컷 고양이에요오늘 배를 보니깐 꿰맨 곳에 붉게 동그란 뭐가 났더라고요이거 원래 이런 건가요? 다른 고양이 중성화했을 땐 이러지 않았던 것 같아서요.. 참고로 어제 항생제주사도 맞았어요,https://kin.naver.com/qna/detail.naver?d1id=8&dirId=80511&docId=492117831&qb=6rOg7JaR7J20&enc=utf8
고양이 변비약 소량 섭취,고양이를 두마리 키우고있는데 두마리 간식 주다가 변비약 복용 중인 고양이 츄르 섞던 숟가락으로 복용 안하고있는 고양이 간식을 섞었어요ㅠㅠㅠㅠ 변비약 안 먹는 고양이 괜찮겠죠?ㅠㅠ,https://kin.naver.com/qna/detail.naver?d1id=8&dirId=80511&docId=492439650&qb=6rOg7JaR7J20&enc=utf8
고양이 분양 후 선천적 질병 발견 시 치료비 청구 가능할까?,"아기고양이 랙돌 2025.6.25일출생 캐터리샵에서 11월경 분양받고(이때는 스코티쉬폴드 유전병문제 널리 퍼진것은 알고있었음) 2026.2월 24일 중성화 수술일정 조절해서 1차 동물병원에서 랙돌 선천성 심장질환에대해 이야기 처음들어서 심적으로 되게 많이놀랐습니다. 마취전에 돌연사나 쇼크 확률이높아서 피검사 필요하다에 동의하다보니 1차병원에서 심장쪽 의심소견이필요해서 지출15만원 결제하고 2차 심장전문병원가서 초음파 검사 비용 10만원 지출해야했기때문에 수급자인 저로써 비상금대출 결국 뚫어서 300만원 긴급개설하고 신용도하락 페널티 감수했음 이후 분양샵에서 이런사실 알고있었냐 하니 분양샵측에서는 사실 모든고양이가 다있다라는식으로 알고는있었지만 책임회피성발언으로 밖에 안보였음 그이후로 심장질환 발견되었다고 말하니 죄송하다 펫샵에서 연계하여 중성화수술비용 저렴하게 해주겠다하는데 비용이 문제가아니라 비용아끼다 내 고양이 죽으면 책임질것도아니고 그동안 아기고양이와 내가 쌓은 행복 유대감이 통째로 사라지는건데 이건 돈으로 보상될문제가아님 그래서 더욱 화가남이미 고양이를 90만원 고가에 분양받고 데려왔때뭄에 어쩔수없는 부분이나 판매자는 이를 사전에 고지할의무가 있었음 사기죄 성립 충분히 되어보이는데 사기죄요건 성립되는지에 대한구체적인 조언 부탁드립니다.  관련태그: 기타 재산범죄, 소비자/공정거래",https://kin.naver.com/qna/detail.naver?d1id=6&dirId=60215&docId=492178880&qb=6rOg7JaR7J20&enc=utf8
고양이 사료 토,고양이가 아까 사료먹고 토를 해서 정리해줬는데 또 사료먹고 다시 토했어요.. 뭐가 문제일까요 ㅠㅠ,https://kin.naver.com/qna/detail.naver?d1id=8&dirId=80511&docId=492377502&qb=6rOg7JaR7J20&enc=utf8
아기고양이 재채기,"생후 2,3개월 된 아기 고양이가 자꾸 재채기를 해요 콧물도 식욕 저하도 없는데 재채기를 자주 해요겨울이라 그런가 왜이러는 걸까요",https://kin.naver.com/qna/detail.naver?d1id=8&dirId=80511&docId=491630838&qb=6rOg7JaR7J20&enc=utf8
고양이 요로결석,요로결석이여도 감자크기가 크게 나올수 있나요? 요로결석 증상에도 빈뇨가 있던데요.. 이게 방광염이랑 헷갈릴수도 있다해서요한번 쌀때 감자 크기가 여자 손바닥 절반 정도거나 이거보다 좀 작은 정도인데 이걸 고양이가 한번에 다 싸지않고 한번 갔다가 제가 바로 치워주면 다시 들어가서 싸요... 화장실은 깨끗해요 며칠전에 화장실 다 씻고 모래 전체갈이 해주기도 했고.. 맘같아선 당장 병원데려가서 검사해보고 싶은데 시골이라 차타고 도시 나가야되고 병원만 가면 사람하나 죽일듯이 사나워서 응급이 아닌이상 쫓겨날것 같아요.......빈뇨있는 고양이들 보면 막 수십번씩 왔다갔다던데 저희집 고양이는 두번씩 나눠서 하루에 세번 정도가니까 총 여섯번 정도거든요.. 이런데도 요로결석 위험이 있을까요? 수컷이고 나이가 있다보니 너무 걱정돼서 제가 정신병걸릴것 같네요ㅠㅠ,https://kin.naver.com/qna/detail.naver?d1id=8&dirId=80511&docId=491926028&qb=6rOg7JaR7J20&enc=utf8
고양이가 빈혈로 떠날때 고통의 강도는 얼마나되나요,"스무살 고양이를 키우고있습니다.간 부분 괴사로 보이는게 있고, 만성 신부전에 배에는 5cm 악성종양이 있어 장기 위치도 밀려있는 상태입니다.(췌장염도 있고 ibd도 추정)탈수와 빈혈(14%)도 심한 상태인데 나이가 있어서수술, 수혈은 포기하고 조혈주사만 한번 맞은 상태인데요이것도 고양이가 병원 스트레스가 많아서 그만두기로 했습니다제가 궁금한것은...빈혈로 고양이가 세상을 떠나게 될 때 많이 고통스러울까요? 숨이 턱턱 막혀서 질식의 공포가 생기는 정도라면그 때가 오기 전에 먼저 보내주는것도 나쁘지 않을 것 같아서고민중입니다..빈혈로 떠나게 될 때 잠자듯 평온하게 간다는 의견도 있는데궁금합니다",https://kin.naver.com/qna/detail.naver?d1id=8&dirId=80511&docId=492277950&qb=6rOg7JaR7J20&enc=utf8
고양이와개,4개월 된 고양이가6년된 강아지의 사료와 시저를 계속 먹어요..못먹게 말리면 그때 뿐....슬금슬금 와서 먹고있더라...그냥 계속 먹도록 놔둬도 되나요..,https://kin.naver.com/qna/detail.naver?d1id=8&dirId=80511&docId=492125619&qb=6rOg7JaR7J20&enc=utf8
고양이 이상행동,고양이가 하루만에 갑자기 이상한 소리를 내면서 토하기를 반복해요 저녁에만 그러고 요새 숨어서 잘 나오질 않아요 이틀쨉니다 ㅠㅠ 왜그런걸까요,https://kin.naver.com/qna/detail.naver?d1id=8&dirId=80511&docId=492345963&qb=6rOg7JaR7J20&enc=utf8
고양이 토하고 잠,고양이가 어제 새벽부터 토하더니 위액까지 다 토해내더라구요 토도 많이 했어요 ㅠㅠ 애가 기운이 없더니 하루종일 자고 밥이나 츄르도 거부하네요 ㅠㅠ 하룻밤 자고 지나면 괜찮아질려나요? 상태가 계속된다면 병원에 가려구요,https://kin.naver.com/qna/detail.naver?d1id=8&dirId=80511&docId=492036155&qb=6rOg7JaR7J20&enc=utf8
