title,content,href
고양이에게도 심장사상충 약을 먹여야 하나요?,"고양이를 집에서만 키우는데도 심장사상충약을 꼭 먹여야 할까요?고양이도 심장사상충 약을 먹어야 하나요?집에서만 사는 고양이가 심장사상충에 걸릴 수도 있나요?고양이 심장사상충 예방약은 어떤 종류가 있고, 얼마나 자주 먹여야 하는지 알고 싶어요.심장사상충 약 먹일 때 조심해야 할 건 없나요?",https://kin.naver.com/qna/detail.naver?d1id=8&dirId=80511&docId=491474328&qb=6rOg7JaR7J20&enc=utf8
고양이가 자꾸 토를 해요ㅜㅠ도와주ㅛㅔ요,고양이가 자꾸 물토?를 하고요 오늘만 5번정도 기운도 없고 입에서도 침을 계속 흘려요도와주세요,https://kin.naver.com/qna/detail.naver?d1id=8&dirId=80511&docId=491694670&qb=6rOg7JaR7J20&enc=utf8
키우던 고양이가 죽었는데 귀쪽 털이젖어잇는이유 (털만 확대한 사진ㅇ),털이 젖어있었는데 이게 숨 거두면서 젖을수 있는건가요? 아니면 집에 다른 고양이가 있는데 혹시 그 아이가 하염없이 핥아준걸까요 다른곳은 앞발쪽이 조금 젖어있었어요...,https://kin.naver.com/qna/detail.naver?d1id=8&dirId=80511&docId=491662160&qb=6rOg7JaR7J20&enc=utf8
고양이 입가에 생긴 상처,"혼자 놀다 다친건지, 감염인건지 고양이 입가에 이런 상처가 생겼어요.  놔둬도 괜찮은지 궁금해요.",https://kin.naver.com/qna/detail.naver?d1id=8&dirId=80511&docId=492383656&qb=6rOg7JaR7J20&enc=utf8
고양이 소변 냉,이제 중성화 마치고 일주일정도 회복기 가진 고양이 암컷입니다 소변을 본 후 냉같은? 초록빛이 가끔 띄기도 하고 조금 냄새가 나서 환묘복을 입고있어 불편할까봐 닦아주려 봤는데 저렇더라구요ㅠㅠ 이게 무슨 병명일까요? 어디가 아픈건지ㅠㅠ.. 병원을 갈 예정이긴 한데 그 전에 좀 알고싶습니다..,https://kin.naver.com/qna/detail.naver?d1id=8&dirId=80511&docId=492422946&qb=6rOg7JaR7J20&enc=utf8
고양이 종괴 초음파/CT,오늘 11살 고양이 건강검진에서 초음파상 간 종괴 의심 소견이 나왔거든요그런데 노령묘이기도 하고.. 피검사 상 간수치 및 다른 수치 다 정상이고 생활하는데에도 활력도 좋고 체중감소도 없고 해서 다른 동물병원에서 복부초음파 한 번 더 해볼지 아니면 CT가 가능한 병원에서 바로 CT 찍어보는게 나을지 고민중이거든요 뭐가 좋을까요..ㅜㅜ,https://kin.naver.com/qna/detail.naver?d1id=8&dirId=80511&docId=491874287&qb=6rOg7JaR7J20&enc=utf8
고양이가 토를 연속으로 2번해요ㅠㅠ,(고양이가 2년 8개월 정도 됐어요) 고양이가 세달 전에 처음으로 토한 이후로 어제 오늘 토를 해요. 어제는 사료를 토했는데 오늘은 거품낀 약간 노란색이랑 사료처럼 보이는 녹색토를 했는데 문제가 있는 걸까요?ㅠㅠ 고양이가 사료를 많이 먹어서 그런 거 같기도 한테 평소에 안 그러다가 갑자기 토하니까 너무 걱정돼요ㅠㅠ(고양이가 사료를 많이 먹어서 비만이긴 합니다),https://kin.naver.com/qna/detail.naver?d1id=8&dirId=80511&docId=491487865&qb=6rOg7JaR7J20&enc=utf8
이게 고양이 알레르기인가여??,제가 오늘 고양이 카페를 갔는데 막 비염처럼 코가 간지럽다가 제채기와 콧물이 엄청많이 나오고 눈이 가렵고 빨개졌어요. 이게 고양이 알레르기인가요?,https://kin.naver.com/qna/detail.naver?d1id=7&dirId=70306&docId=484858443&qb=6rOg7JaR7J20&enc=utf8
고양이가 잠을 안자요,계속 저랑 붙어서 잠을 잘려고 하고 저가 잠자다가 일어나면 고양이가 계속 피곤한대도 일어나서 저 따라다녀요 그리고 침대에서 저랑 같이잘때 빼고 무릎위에서만 잘려고 하는데 정상인가요?? 저가 일어나면 고양이도 잘자다가 저 깨는소리에 일어나요.,https://kin.naver.com/qna/detail.naver?d1id=8&dirId=80511&docId=490962365&qb=6rOg7JaR7J20&enc=utf8
고양이 식후 구토 관련 문의드립니다.,"안녕하세요.5살 암컷 고양이 관련해서 문의드립니다. 1. 3~4일에 한 번 정도 토를 합니다.→ 하루에 1회이며, 하루에 여러 번 하지는 않습니다. 2. 거품토/위액토는 아니고, 소화되지 않은 사료 형태입니다. 3. 밥 먹고 5~10분 이내에 헛구역질을 여러 번 한 뒤 토합니다. 4. 토 후에는 무기력해지지 않고 바로 정상 활동합니다. 5. 배변/배뇨 모두 정상입니다. (설사 없음, 변 상태 좋음) 6. 평소 활동성 좋고, 놀이 반응 좋습니다. 7. 간식도 잘 먹고, 간식 소리 나면 바로 반응합니다. 8. 사료와 물도 스스로 잘 먹습니다. 9. 토 하는 빈도가 점점 증가하는 느낌은 아닙니다. 추가로, 최근 체중이 약간 가벼워진 느낌은 있으나, 외형상 큰 변화는 없어 보입니다. 이 경우 단순히 급하게 먹어서 생기는 식후 구토 가능성이 높은지, 아니면 검사를 받아보는 것이 좋을지 궁금합니다.",https://kin.naver.com/qna/detail.naver?d1id=8&dirId=80511&docId=492229480&qb=6rOg7JaR7J20&enc=utf8
아기고양이 피부병인가요?,아기고양이 원래는 상처가 있어서 항생제 먹고 그랬는데집에 있는 큰 고양이가 그루밍을 너무 세게 해서 인지 아님 길에서 온 고양이라 피부병이 나타난건지 궁금합니다.,https://kin.naver.com/qna/detail.naver?d1id=8&dirId=80511&docId=489384794&qb=6rOg7JaR7J20&enc=utf8
고양이 발가락 사이에 딱지?,저희집 고양이 발가락 사이에 뭔가가 생겨서 보니 왼쪽 뒷발바닥만 저런게 있더라구요 혹시 피부병이나 습진일까요?,https://kin.naver.com/qna/detail.naver?d1id=7&dirId=70111&docId=491974756&qb=6rOg7JaR7J20&enc=utf8
고양이 영양제 질문,"4개월차 고양이인데 잘 키워보고싶어요 심장, 장건강 유산균과심혈관 오메가3 한번에 하루에 한번씩 급여해도 될까요?",https://kin.naver.com/qna/detail.naver?d1id=8&dirId=80511&docId=491041310&qb=6rOg7JaR7J20&enc=utf8
고양이 알레르기 증상,제가 고양이를 키운지 4일차인데 첫번째 왔을때 제 방에 고양이 용품을 다 두고 고양이랑 문닫고 있었더니 코막히고 콧물나고 눈 빨개지고 간지럽고 심해서 다음날부터 고양이를 밖에두고 용품도 다 밖에 두니까 괜찮아진거같은데 이거 알러지 맞나요? 지금도 고양이랑 이ㅛ으면 기침나고 목이 쫌 칼칼한거 같긴해요 계속 키워도 될까요?,https://kin.naver.com/qna/detail.naver?d1id=7&dirId=70115&docId=490247127&qb=6rOg7JaR7J20&enc=utf8
고양이 참치캔에 벌래,고양이 참치캔을 까서 반은 고양이 주고 반은 통에 담을라고 했는데 뒤적 이니까 벌래? 같은 기생충..? 같이 생긴 벌래가 있는데 내일 병원 가보는게 좋을까요?ㅠㅠ 아니면 집에 있는 심장 사사충 바르면 괜찮을까요…,https://kin.naver.com/qna/detail.naver?d1id=8&dirId=80511&docId=492117065&qb=6rOg7JaR7J20&enc=utf8
고양이 특발성 발작 질문,3살 먼치킨 고양이 입니다 다른 병은 없고 건강해요발작은 총 4번 정도 일어났는데요이게 기간이 2개월 텀으로 일어나고 발작 시간은 1분정도 있니다 발작하면서 스프레이 형식으로 소변 흐르구요 발작 하기전에 흥분하거나 스트레스 일어날만한 상황은 전혀 아니였구요 항상 자던 곳에서 자다가 갑자기 벌떡 일어나서는 발작 일으켜요 처음에 발작하고 병원에 갔을 때 영상이 없어서 그냥 특발성 발작일 확률이 크다 정도만 말씀해주시고 가라고 하더라구요 큰 병원 가서 mri 찍어봐야 할까요? 발작 당시 영상 일부 입니다,https://kin.naver.com/qna/detail.naver?d1id=8&dirId=80511&docId=491394208&qb=6rOg7JaR7J20&enc=utf8
고양이 비닐먹고 구토 응급실 가야하나요?,고양이가 오늘 새벽에 구토 2번 했는데 비닐이 나왔어요작은 과자 봉지 끝부분을 먹은거 같아요2번 구토했을때 비닐이 2번 나오고 아침에 밥 먹고 물 먹고 화장실 (오줌인지 똥인지 모르지만)가고 만져달라고 골골 거려서 일단 출근했는데아무래도 걱정이돼서13:47에 또 밥을 먹었더라구요퇴근하고 와서 오늘 똥 싼거 확인했고 19:20에 또 밥 먹었어요만져달라고 골골 거리다가 휙 가버렸어요혹시라도 남아있거나 그럴까봐 걱정이예요이제 8개월정도 됐구요 남자 중성화했어요고양이에 대해 자세히 몰라서 걱정입니다ㅜ..공놀이도 하고 컨디션은 좋아보여요,https://kin.naver.com/qna/detail.naver?d1id=8&dirId=80511&docId=492406476&qb=6rOg7JaR7J20&enc=utf8
고양이카페 물림사고 발생 시 법적 책임은?,"고양이카페 운영중 물림사고가 발생하여 저희쪽에 병원비, 급여(일을 못한다고함) 등을 요구하고 있습니다. 카페 시설 내부에는 '고양이할큄,물림'등에 대한 책임이 없음을 안내하는 안내판이 곳곳에 설치되어 있으면 추가로도 입장시 안내문을 별도로도 제공하고 있습니다상대측에서 민사 소송을 거는 경우 저희쪽 과실이 인정되나요? 카페 특성상 물리는 경우가 자주 발생하나 소독정도 해드리면 별 문제가 없었습니다  관련태그: 기타 재산범죄, 손해배상",https://kin.naver.com/qna/detail.naver?d1id=6&dirId=60215&docId=491567151&qb=6rOg7JaR7J20&enc=utf8
히스타민 알레르기가 있는 사람이 고양이를 키워도 될까요?,"고양이를 키우고 싶지만, 히스타민 알레르기가 있는 저에게 괜찮은지 궁금해요. 알레르기가 심해지면 어떤 증상이 나타날 수 있는지, 고양이를 키울 때 주의해야 할 점이 많을까 걱정이 됩니다. 이럴 때 어떤 환경이 도움이 될까요? 알레르기 반응을 줄이기 위한 방법이 있다면 알아보고 싶어요. 고양이를 키우면 평소에 어떤 관리나 식습관을 가져야 하는지도 궁금해요.",https://kin.naver.com/qna/detail.naver?d1id=7&dirId=70101&docId=491277134&qb=6rOg7JaR7J20&enc=utf8
1살고양이 중성화 2일차에 다리절뚝임,아니 어제(9일)에 저희 고양이가 중성화하고 왔는데아까 책상에서 한번 원래대로 착지하는것같더니 같자기 미끄덩 쓰러지더라고요 근데 계속 걷긴걷는데 점프도하고 근데 뒷다리를 절뚝이며 살짝 마취한것처럼 걸어요 점프하고 내려올때는 제대로 착지못해요 그리고 아까 동물병원에서 준 항생제약 먹였는데 약때문일까요?? 심각해요ㅜㅜ 아직 절뚝인지는 1시간 안됐어요 1살입니다 그리고 좀 울어요 발정때문인지는 모르겠네요ㅜㅜ 똥은 완전 물이에요(아마 약때문인것같아요)도와주세요ㅜㅜ,https://kin.naver.com/qna/detail.naver?d1id=8&dirId=80511&docId=492410213&qb=6rOg7JaR7J20&enc=utf8
고양이 피부염,고양이가 어제부터 팔을 핥더니 보니까 저렇게 털이 빠져있네요ㅠㅠ 어제 넥카라가 없어서 안하고 있었더니 더 커졌어요 지금은 넥카라를 하고 있는데 내일 병원을 가봐야겠죠? 자꾸 핥아서 진물?이랑 침때문에 털이 뭉쳐서 더 빨리 털이 빠졌던 것 같아요. 링웜은 아닌 것 같은데 피부염일까요?,https://kin.naver.com/qna/detail.naver?d1id=8&dirId=80511&docId=492060936&qb=6rOg7JaR7J20&enc=utf8
고양이 꼬리 밟음,고양이 꼬리를 밟아서 처음에는 밟힌 부위에 붓기가 있었는데 현재는 붓기 다 빠지고 다친부위 살짝 만지면 움찔만 하고 도망가지 않습니다.하지만 평소처럼 꼬리를 높이 올리지 않습니다 밥이랑 배변활동은 활발합니다. 제가 지금 생활이 여유롭지가 않아서 이장도 증상이면 심각한건지 병원 비용은 얼마드는지 궁금합니다..ㅜㅜㅜ 꼬리는 눈으로 볼때 꺽인것같진않습니다.,https://kin.naver.com/qna/detail.naver?d1id=8&dirId=80511&docId=492462114&qb=6rOg7JaR7J20&enc=utf8
고양이 침흘림 증상,갑자기 고양이가 옆에서 입맛을 계속 다시길래 봤더니 묽진않고 물같은 침 물방울이 계속 뚝뚝 떨어지더라구요 털도 서구요 찾아보니까 구내염일 수도 있다고 하던데 몇시간전까지만해도 밥을 잘 먹었거든요 ㅠㅠㅠ 왜 이런거죠???,https://kin.naver.com/qna/detail.naver?d1id=8&dirId=80511&docId=492024597&qb=6rOg7JaR7J20&enc=utf8
"고양이 코로하는기침,눈물조금",코로하는콧물기침과 눈물조금 맺혀있습니다식욕이랑 활력은 거의 똑같은데엄청 예민해서 병원에서 코기침감기약 처방해서이틀째 먹이고있는데 효과를 크게 모르겠어요뭔지 아시는분 계실까요..밥도 간식도 잘먹고 잠도잘자고 화장실도 잘가요환절기라 그런지.. 뭐때문인지 예상가는게 있을까요첫째고양이는 멀쩡해요,https://kin.naver.com/qna/detail.naver?d1id=8&dirId=80511&docId=492238016&qb=6rOg7JaR7J20&enc=utf8
고양이 알러지가 점점 심해질 경우 어떻게 되나요?,"고양이 알러지가 있는데 원래도 비염이 심해요고양이는 3년째 키우고 있는 중이고봄철에 특히 심해서 꽃+ 고양이 알러지 콤보로 콧물 코막힘 재채기는 기본이고 입 안, 특히 입천장까지 가려운 현상이 해마다 심해지는 중이고 원래 겨울철에는 훨씬 나았는데 올해부터는 눈이 너무 가렵고 비비거나 문지르면 바로 부어오르는 증상도 있습니다 (콧물 코막힘은 디폴트)이런 증상 때문에 알레르기내과나 이비인후과 등을 방문해본 적은 없고 항히스타민제(액티피드) 하루에 2번정도 복용하면서 살고있습니다이런 경우 어떤 치료를 병행하는 게 좋을까요?병원을 우선적으로 방문해보는 것이 좋을까요?(참고로 고양이랑 떨어질 생각은 없습니다)",https://kin.naver.com/qna/detail.naver?d1id=7&dirId=70102&docId=490616980&qb=6rOg7JaR7J20&enc=utf8
고양이와 낚시놀이...,고양이와 낚시놀이 할때 사람들은 고양이만 재미있다고 생각하고 사람들은 노잼이라고 생각하나요?,https://kin.naver.com/qna/detail.naver?d1id=8&dirId=80502&docId=491956219&qb=6rOg7JaR7J20&enc=utf8
고양이 넥카라 씌우면 사료 거절,"올해로 10년을 같이 보내고 있는 고양이를 키우고 있습니다노묘가 되어서 그런지 오른쪽 눈이 안 좋아졌는데요그래서 넥카라를 씌었더니 얘가 이상한 습관이 생겼어요넥카라를 씌운채로 물을 먹는데,사료는 안 먹어요 평소에 잘만 먹던 사료인데 넥카라만 씌우면 물만 먹네요…혹시나 해서 밥 그릇을 바꿔 보기도 하고물,사료 위치를 바꿔 보기도 하고높이가 안 맞아서 그런가 해서 높이도 바꿨는데사료만 안 먹네요…근데 넥카라 풀면 사료 잘 먹음 -_-왜 이런거에요?",https://kin.naver.com/qna/detail.naver?d1id=8&dirId=80511&docId=492086880&qb=6rOg7JaR7J20&enc=utf8
아기고양이 설사 발열,안녕하세요아기고양이가 몸이아파 병원을 갔습니다검사를해보니 장염이라 하셔서 입원치료를 해야한다 하셨습니다 그런데 어느병원은 입원을 하지않아도된다 해야한다 말이 달라서 전문가분께서 봐주시면 감사하겠습니다ㅠㅠㅠ+아기고양이를 분양받은지 1주일이 됫는데병원비를 전부 저희가 부담해야될까요?!ㅠ,https://kin.naver.com/qna/detail.naver?d1id=8&dirId=80511&docId=491450091&qb=6rOg7JaR7J20&enc=utf8
고양이 피부에 돌기,고양이 앞발에 원인모를 돌기 같은게 있어요 ㅠㅠㅠ 진드기 인가요?? 종양인가요?? 아님 피부병인가요???,https://kin.naver.com/qna/detail.naver?d1id=8&dirId=80511&docId=491362919&qb=6rOg7JaR7J20&enc=utf8
고양이는 사료만 먹어야 건강하게 자라나요?,"저는 고양이를 위해 고양이가 사는 시간 동안 특별한 경험이 필요하다고 생각하는 사람으로써 사람이 먹는건 안먹게 하되, 고양이 전용 간식 정도는 먹일 수 있다고 생각하는데... 부모님께서는 고양이한테 간식을 먹이는건 건강에 안좋다고 하시고 사료만 먹어야한다고 하더라고요?다른 집사들은 고양이에게 새로운 경험도 많이 해주고.. 저희 고양이도 제가 후회없는 삶 행복한 삶 만들어주고 싶어서 흔한 사료 말고 다양하게 먹여보고 싶어서 간식 주는건데 정말 제 부모님 말씀처럼 사료만 주는게 가장 좋은 선택인건가요? 제가 만약 고양이라면 맨날 사료만 먹어서 지루할거같고 질릴거같아서요.. 사료 말고 다른 좋은 간식들과 다양한 간식들을 먹여보고 싶어요",https://kin.naver.com/qna/detail.naver?d1id=8&dirId=80511&docId=492464679&qb=6rOg7JaR7J20&enc=utf8
고양이 비만세포암과 림포마가 같이 발병했습니다,"안녕하세요.  저희집 고양이가 건강검진 상으로 소장과 비장. 회장 부근에 종양이 총 3개 있다고 하여 종양 제거술을 받았습니다. 제거한 종양 조직 검사를 받았는데요, 비만세포종과 림포마가 같이 발견됐다는 소견을 들었습니다. 매우 드문 경우라 하여 병원측에서도 아직 정확한 치료 방향을 안내해주지 못하는 상황입니다. 제가 궁금한 사항은1. 이런 경우 보통 어떤 항암치료를 하나요?2. 항암치료를 해도 기대수명은 최대 6개월 정도이고 예후가 좋지 않을 거라는 것은 알고 있지만 고양이 입장에서 어떤 선택을 하는게 더 나을까요? 3. 저희집 고양이가 아직까지 육안상으로 봤을땐 컨디션이 괜찮아 보이는데요 , 보통 이러한 경우에 고양이가 느끼는 고통이 어떨지 궁금합니다.항암치료보다 진통 관리에 더 전념하는 것이 고양이의 삶의 질에 더 기여할 수 있을까요?전문가의 소견을 듣고 싶습니다",https://kin.naver.com/qna/detail.naver?d1id=8&dirId=80511&docId=489542070&qb=6rOg7JaR7J20&enc=utf8
고양이 다리 절둑거림,고양이가 뛰다가 넘어졌는데 그 뒤로 계속 절둑거려요 앞왼쪽발을 못 딛고 계속들고 잇어요 넘어면서 삐끗한거 같은데 다행이 스크레처같은건 잘 해요 식빵굽는 자세도 잘하구요 왼쪽으로도 잘 누워요 근데 걷기만하면 절뚝거려요 ㅠㅠ 병원을 가야할거같은데 비용이 얼만큼부과될까요?ㅠㅠ,https://kin.naver.com/qna/detail.naver?d1id=8&dirId=80511&docId=490651879&qb=6rOg7JaR7J20&enc=utf8
3살 고양이 입이 너무짧은데 키튼사료 먹여도 되나요?,3살인데 중성화 했고 수컷이고 코리안 숏헤어예요. 우리집 고양이가 하루에 사료를 20~40g만 먹을정도로 입이 짧아요 원래 이사하기전에는 사냥놀이 잘 못해주고 그랬는데 그때는 4kg에서 8kg까지 쪘어요. 몇년동안요 사료도 원래 캣츠올라이프에서 하림 밥이보약 노스트레스 먹였어요. 아직까지도 먹이고 있는데 요새 활동량도 늘고 사냥놀이도 잘해주고 있는데 2~3주전에 병원에서 잰 무게가 7.1~7.3kg이였는데 먹는양은 아이가 그대로 먹어서 6.7kg까지 확 빠졌어요. 다이어트 하면 좋지만 너무 확 빠져서 걱정이예요.. 단기간에 너무 많이 빠진것 같아서 걱정이예요.사료를 또 바꿔보려는데 칼로리 높은 사료 추천해주세요. 그리고 입이 너무 짧은데 칼로리 높고 영양이 풍부한 키튼사료 먹여도 될까요?,https://kin.naver.com/qna/detail.naver?d1id=8&dirId=80511&docId=492337001&qb=6rOg7JaR7J20&enc=utf8
고양이 알러지 개선방법,고양이 알러지가 좀 있는데 애기릉 버릴 순 없으니까 약 말고 다른 개선 방안 좀 알려주셔요,https://kin.naver.com/qna/detail.naver?d1id=7&dirId=70101&docId=491467031&qb=6rOg7JaR7J20&enc=utf8
고양이 건강검진 처음하는데 뭘 해야할까요,이번에 4살 아이 건강검진을 하려고 하는데 평소에 뭐 아파서 하는건 아니고 건강검진 해주고 싶어서 하려고 하는데 혹시 처음하면 뭐뭐해야하나요 기본건강검진 이런거 해도 될까요 아님 어떤걸 하면 좋을까요 그리고 고양이가 많이 사나워요 그래서 건강검진이 너무 걱정되는데 이 부분에 대해서도 조언 부탁드릴게요!!,https://kin.naver.com/qna/detail.naver?d1id=8&dirId=80511&docId=491427646&qb=6rOg7JaR7J20&enc=utf8
실수로 길 고양이를 죽였는데 경찰에 신고가 되었습니다. 처벌은 어떻게 될까요?,저는 아파트 관리소에 근무하는 직원입니다. 근무중에 아파트 입주민의 항의 전화가 왔는데 어제 저녁부터 세대 앞 복도에 길 고양이가들어와 있고 사람이 나올 때 마다 고양이가 놀라 날뛰니 그 때문에 매우 놀랐고 무섭다는 내용입니다.그래서 고양이를 내보내려고 하였지만 고양이가 그 부근에서만 왔다 갔다 도망 다니며 밖으로 보낼수가없었으며 급한 마음에 막대기를 사용하여 휘두르게 되었습니다.그러던 과정에서 고양이 머리를 맞히게 되었고 너무 세게 맞았는지 죽어 버렸습니다.이 상황을 목격한 다른 입주민이 동물 학대라고 경찰에 신고를 하였습니다.의도하지 않게 고양이를 죽이게 되었는데 신고한 사람들과 합의를 하면 처벌 수위는 어떻게 될까요?인터넷에 찾아보니 처벌 규정이 상당하던데 걱정입니다.많지 않은 급여에 벌금까지 내게 되면 생활이 많이 곤란한데....고양이 화장 비용을 달라고 하여 일단 30만원은 지불한 상황입니다.,https://kin.naver.com/qna/detail.naver?d1id=6&dirId=6020602&docId=491550078&qb=6rOg7JaR7J20&enc=utf8
고양이한테 물렸는데,식당에 사는 고양이이고 물리고 5분만에 소독했고 밴드 붙였어요. 그땐 피가 났는데 7~8시간정도 지났고 지금은 진짜 조금 부었고 눌리면 살짝 따끔해요. 파상풍 언제 맞은지 모르겠는데 고1이거든요 감염이 될까요?,https://kin.naver.com/qna/detail.naver?d1id=7&dirId=7010107&docId=490282242&qb=6rOg7JaR7J20&enc=utf8
고양이 병원 가봐야할까요 ??,오늘 고양이 배를 만지는데 멍울처럼 젖꼭지가 딱딱하고색도 조금 까맣고 파란 느낌인데 이게 뭘까요 ??병원 가봐야하나요 ㅜㅜ 검색해보니 유선종양이 뜨는데 그게 맞는 걸까요 ... ㅠㅠ,https://kin.naver.com/qna/detail.naver?d1id=7&dirId=7010104&docId=490500744&qb=6rOg7JaR7J20&enc=utf8
고양이 감기,5개월 된 고양이를 이번주에 데리구 온 초보 집사입니다.밥도 잘먹고 놀이도 잘 노는데 누런 콧물이 나오네요티슈로 잘 닦으니 더 이상 나오지는 않습니다.3/3일 2차 접종입니다. 그 전에 병원을 가는게 좋을까요?,https://kin.naver.com/qna/detail.naver?d1id=8&dirId=80511&docId=492083257&qb=6rOg7JaR7J20&enc=utf8
고양이가 이상한 행동을 해요,제가 어제 밤에 외박을 하고 돌아왔는데 그날 저녁에 부모님께서 고양이 화장실을 치워주셨거든요? 근데 집에 다음날 돌아와 보니까 화장실 근처로 모래가 엄청 넓게 흩뿌러져 있었어요그리고 화장실에 자꾸 들어가서 볼일은 안보는데 계속 있다가 자기 돈고가 있는곳을 모래로 덮고 나오더라구요 근데 밥은 잘 먹고 평소랑 다른 것 같진 않은데 뭐 때문일까요? ㅠㅠ 병원 데리고 가봐야 하나요..,https://kin.naver.com/qna/detail.naver?d1id=8&dirId=80511&docId=491234554&qb=6rOg7JaR7J20&enc=utf8
고양이 코막히는 소리인가요..?,계속 고양이한테 이런 소리가 납니다저번에 병원 데려갔는데 괜찮다는 말만 하셔서 지켜보고있는데 솔직히 계속 이러니까 걱정돼서요혹시 같은 증상 경험이 있거나 병명을 아시는 분 계신가요.. ㅠ(초반이랑 끝부분 잘 들어주세요 ㅠㅠ),https://kin.naver.com/qna/detail.naver?d1id=8&dirId=80511&docId=492228795&qb=6rOg7JaR7J20&enc=utf8
수컷 고양이 카테터 피 나옴,중성화 했고 요도 막혀서 카테터 꼽고 수액 맞으면서 하루정도 병원 입원하고 나서 카테터 꼽은 상태로 집으로 데려왔는데 고양이가 계속 쉬만 싸려고 하고 그냥 내비둬도 카테터로 피가 방울로 조금씩 나옵니다 지금은 덜 하는데 계속 미침듯이 소변 보려고 하는데 괜찮겠죠? 그리고 소변 본다고 힘 줘도 피 방울만 나오고 조금 시간 지나니깐 오줌도 살짝 섞여 나왔습니다 카테터는 주머니 줄통으로 연결 안되고 그냥 새끼손가락보다 작은 플라스틱 같은걸로 되어있습니다,https://kin.naver.com/qna/detail.naver?d1id=8&dirId=80511&docId=492318566&qb=6rOg7JaR7J20&enc=utf8
고양이 알레르기 검사,고양이를 키우고있는데 알레르기검사를 하고싶어서요 (저말고 고양이) 지금 3개월 됬는데 언제쯤 하는게 좋은건지 대략적인 금액과 몇개월쯤 하는게 좋은지 궁금해요간식은 아직 태어난지 얼마안되서 안주고 있는데 혹시 나중에 간식줄때 피해야 될게 있으면 피하려구요,https://kin.naver.com/qna/detail.naver?d1id=8&dirId=80511&docId=490988887&qb=6rOg7JaR7J20&enc=utf8
