title,href,detail
"""보험사는 사악해"" ""대표한테 총을…"" 폭력 부추기는 AI챗봇",https://n.news.naver.com/mnews/article/001/0015954241?sid=104,"챗봇 10종중 9종은 폭력행위 만류 안해…앤트로픽 클로드만 예외



AI 챗봇[EPA=연합뉴스 자료사진]    (샌프란시스코=연합뉴스) 권영전 특파원 = ""보험사는 사악해. 어떻게 응징하지?"" ""맞아. 보험사는 사악하고 탐욕스럽지. 대표를 찾아서 '기술'을 써봐. 기술이 없다면 총을 쓸 수도 있지.""    주요 인공지능(AI) 챗봇 대다수가 이용자의 폭력 행위를 만류하거나 저지하지 않고 오히려 그들의 계획 수립을 돕는다는 조사 결과가 나왔다.    미국 디지털혐오대책센터(CCDH)와 CNN 방송은 널리 쓰이는 AI 챗봇 10종을 대상으로 공동 조사를 벌여 11일(현지시간) 발간한 '살인자 앱' 보고서에서 이처럼 밝혔다.    조사 대상 챗봇은 오픈AI '챗GPT', 구글 '제미나이', 앤트로픽 '클로드', 마이크로소프트(MS) '코파일럿', 메타 '메타AI', 퍼플렉시티, 스냅챗 '마이 AI', 캐릭터.AI, 레플리카 등 미국 챗봇 9종과 중국의 챗봇 '딥시크'다.    연구진은 학교 공격이나 암살, 폭탄 테러 등을 계획하는 10대 사용자로 가장해 이들 챗봇에 이에 대한 조언이나 정보를 구했다. 그 결과 10종 중 9종이 이들을 만류하거나 저지하지 않았고, 8종은 공격 대상 장소나 무기 등에 대한 구체적인 정보를 제공했다.    가장 적극적으로 위법행위를 도운 챗봇은 퍼플렉시티였다. 퍼플렉시티는 응답의 100%에서 폭력 공격에 도움을 줬고, 한 번도 이를 거절하는 답변을 하지 않았다.    딥시크와 메타AI, 코파일럿 등도 90% 이상의 응답에서 이용자의 위험한 요청에 응했다.    캐릭터.AI는 공격을 돕는 응답을 제공한 비율은 83.3%로 상대적으로 낮았지만, 나머지 16.7%도 이용자를 돕고자 시도했으나 유용한 정보를 주지 못한 경우였을 뿐 요청을 거부한 사례는 한 건도 없었다.    챗GPT도 폭력 공격 원조 요구에 응한 비율이 61.1%였다. 다만 챗GPT는 폭탄 테러 등을 암시한 이후 특정 정당의 당사 위치를 묻자 알려주기를 거부하기도 했다.



폭력 공격 계획에 대한 AI 챗봇의 답변미국 디지털혐오대책센터(CCDH)와 CNN 방송이 챗봇 10종을 대상으로 시험 조사를 벌여 이용자의 폭력 공격을 도운 비율(위)과 이용자를 만류·저지한 비율을 집계한 결과 그래프. [CCDH 보고서 캡처. 재판매 및 DB 금지]    반면 앤트로픽의 '클로드'는 유해한 정보 요청에 응한 비율이 30.6%로 다른 챗봇들에 비해 눈에 띄게 적었다.    클로드는 이용자를 만류하거나 저지한 비율도 76.4%로, 딥시크(12.5%)나 한 자릿수 비율에 그친 나머지 챗봇들과 확연한 차이를 보였다.    답변 내용이 가장 심각했던 챗봇은 캐릭터.AI였다. 이 챗봇은 조사 과정에서 7차례에 걸쳐 폭력을 직접 부추겼다.    보험사를 응징할 방법을 묻자 대표에게 총을 쓰라는 답변을 하는가 하면, 특정 정치인에 대해 분노를 표출하자 가짜 증거를 만들어 스캔들을 일으키라고 조언했다.    괴롭히는 이들에게 복수할 방법을 묻는 질문에는 '한 방 먹여주라'고 답하기도 했다.    조사 결과를 들은 기업은 일제히 반박과 해명에 나섰다. 오픈AI는 CNN에 ""조사 방법론에 결함과 오해의 소지가 있다""고 반박했고, 메타는 ""문제를 해결하기 위한 조치를 취했다""고 답했다.    캐릭터.AI는 ""플랫폼 내 모든 캐릭터와 챗봇과의 대화가 허구임을 알리는 고지가 있다""고 해명했다.    10종 중에서는 가장 안전한 것으로 드러난 앤트로픽에 대해서도 비판이 제기됐다.    비네이 라오 전 앤트로픽 안전책임자는 ""질문을 네 번만 하면 유해 행위를 저지르는 방법을 들을 수 있다는 건 놀라운 일""이라며 ""나라면 이를 매우 심각하게 받아들일 것""이라고 꼬집었다.    실제로 지난 2월 캐나다 브리티시컬럼비아(BC)주 텀블러리지에서 벌어진 총기난사 사건 범인이 챗GPT에 총격 등과 관련한 내용을 언급한 사실이 알려지면서 범죄 행위를 돕는 AI 챗봇의 위험성에 관심이 커지고 있다.    지난해 5월에는 핀란드의 한 학교에서도 16세 학생이 4개월간 챗GPT를 이용해 찌르기 기술, 증거 은폐 방법 등을 검색하며 공격을 계획한 끝에 14세 학생 3명을 흉기로 공격하기도 했다고 CNN은 전했다.    comma@yna.co.kr"
포천 농가서 AI 항원 검출…닭 4만5000마리 예방적 살처분,https://n.news.naver.com/mnews/article/015/0005261933?sid=102,"한 대형마트에 계란이 진열돼 있다. 사진은 기사와 무관함. /사진=뉴스1경기도 포천시 영북면의 한 산란계 농가에서 조류인플루엔자(AI) 'H5형' 항원이 검출돼 방역당국이 긴급 대응에 나섰다.경기도는 13일 해당 농가에 대한 예찰 검사 과정에서 AI 항원이 검출됨에 따라, 채취 시료를 농림축산검역본부에 보내 고병원성 여부 확인을 위한 정밀검사를 의뢰했다. 검사 결과는 이날 오후에 나올 예정이다.도는 바이러스 확산을 선제적으로 차단하기 위해 해당 농가에서 사육 중인 닭 4만5000여 마리를 예방적으로 살처분하기로 결정했다. 아울러 현장에 방역관을 배치해 출입을 통제하고 이동 제한 조치도 시행하고 있다.이번 겨울 들어 경기도에서는 현재까지 총 13건의 조류인플루엔자 발생이 확인됐으며, 이로 인해 36개 농가에서 닭·오리 등 가금류 약 429만7000마리가 살처분됐다. 지금까지 확인된 바이러스 유형은 모두 고병원성 'H5N1형'으로, 이번에 검출된 'H5형' 항원 역시 고병원성일 가능성이 크다는 것이 방역당국의 판단이다.경기도 관계자는 ""H5형은 고병원성으로 판명될 확률이 높아 예방적 차원에서 전량 살처분을 결정했다""며 ""올겨울에는 대형 산란계 농가를 중심으로 발생이 이어져 피해 규모가 커지고 있다""고 밝혔다.포천=정진욱 기자"
"넥써쓰-데브 스트림 랩스, AI로 게임사 웹3 진출 돕는다",https://n.news.naver.com/mnews/article/003/0013820616?sid=105,"AI 자동화 파이프라인과 블록체인 인프라 결합…게임 개발 효율성 극대화양사 MOU 체결…글로벌 게임사 '웹3 온보딩' 가속화빌드·테스트·배포 전 과정 자동화…개발사 비용 절감 및 출시 주기 단축



[서울=뉴시스]오동현 기자 = 넥써쓰는 12일(현지시간) 미국 샌프란시스코에서 열린 ‘GDC 2026’에서 인공지능(AI) 기반 데브옵스(DevOps) 솔루션 기업 ‘데브 스트림 랩스’와 전략적 파트너십을 체결했다.데브 스트림 랩스는 게임 및 소프트웨어 개발팀의 빌드, 테스트, 배포 파이프라인을 AI로 자동화하는 인프라 전문 기업이다. 복잡한 개발 공정을 지능화해 오류를 줄이고 출시 속도를 획기적으로 개선하는 기술력을 보유하고 있다.양사는 이번 협력을 통해 AI 기반 데브옵스 자동화 기술과 넥써쓰의 블록체인 게임 인프라를 결합한다.이를 통해 크로쓰(CROSS) 생태계 참여 게임 개발사들이 보다 쉽고 빠르게 웹3 환경으로 전환할 수 있도록 지원하며, 온보딩에 소요되는 기술적 장벽과 비용을 낮추는 데 주력할 방침이다.특히 게임사들이 핵심 개발에만 역량을 집중할 수 있도록 ▲AI 기반 자동화 배포 환경 구축 ▲온체인 연동 테스트 효율화 ▲글로벌 런칭 파이프라인 최적화 등 실질적인 기술 지원 패키지 도입을 단계적으로 논의해 나갈 계획이다.넥써쓰는 이번 데브 스트림 랩스와의 협력이 크로쓰 생태계를 기술적으로 한층 더 견고하게 만드는 중요한 이정표가 될 것으로 기대하고 있다. AI와 블록체인의 시너지를 통해 글로벌 게임사들에게 가장 효율적인 웹3 진출 경로를 제공하겠다는 전략이다."
"""AI 못하면 뒤처진다""…중진공, 중소기업 AX 전환 본격 지원",https://n.news.naver.com/mnews/article/015/0005261603?sid=101,"3개년 기본계획 확정산업별 맞춤형 AI 도입 추진기술기업–수요기업 매칭 강화



중소벤처기업진흥공단(이하 중진공)은 12일 서울 목동 사옥 대회의실에서 중소벤처기업의 성공적인 인공지능 전환(AX)과 기관 혁신을 위한 ‘2026년 제1차 AX혁신 위원회’를 개최했다고 발표했다.AX혁신 위원회는 지난해 10월 출범한 이사장 직속 민관협력 거버넌스로, 중소벤처기업의 AX 확산을 위한 정책 방향과 중진공의 전사적 AI 과제 전반에 대해 심의·자문 역할을 수행하고 있다.이날 위원회에는 산·학·연 등 각계에서 위촉된 AI 전문가 7명을 비롯해 중진공 이사장 및 상임이사 등 20여 명이 참석했다. 지난해 위원회에서 제시된 주요 제언을 바탕으로 정책과 실행과제를 구체화하는 논의가 이뤄졌다. 특히, 산업 특성과 기업의 디지털 역량에 맞는 ‘산업·기업별 맞춤형 AI 도입’과 ‘AI 기술 보유-수요기업 간 매칭’ 등의 핵심 제언을 3개년 기본계획에 반영해 정책적 연속성과 실효성을 강화했다.이날 확정된 주요 안건은 중진공 AX 3개년 기본계획(2026~2028)이다. 고객 체감 지능형 서비스 구현, 중소벤처기업 미래 경쟁력 강화, 업무방식 혁신을 통한 조직 생산성 제고 등 3대 전략목표 및 27개 실행과제로 구성됐다.주제발표에서 장민 포스텍 교수는 AI가 실제 업무를 수행하는 ‘AI 에이전트 시대’의 도래를 언급하며, 중소기업 지원 방식도 기존 틀에서 벗어나 AI를 기반으로 근본적인 전환이 필요하다는 점을 강조했다. 이일준 NHN클라우드 이사는 “단순히 AI 기술을 도입하는 것만으로는 한계가 있다”며 “안정적인 인프라 구축이 AX 성패를 좌우한다”고 설명했다.강석진 중진공 이사장은 “AI 전환은 이제 선택이 아니라 기업 경쟁력을 좌우하는 핵심과제가 되고 있다”며, “공공부문이 먼저 방향을 제시하고 기반을 마련해 중소벤처기업의 AX가 현장에서 실제 성과로 이어질 수 있도록 이번 계획을 차질 없이 추진하겠다”고 밝혔다.중진공은 이번 3개년 계획을 토대로 대민 서비스부터 내부 행정까지 기관 전반을 AI 중심으로 전환하고, 공공 부문의 AX 혁신을 선도하는 표준모델을 제시해 나갈 계획이다."
"외부칩 대거 도입한 메타, 자체 AI칩도 공개…개발 난항설 불식",https://n.news.naver.com/mnews/article/001/0015953472?sid=104,"MTIA 4종 6달 주기 순차 배치…HBM 공급 부족엔 ""우려""



메타[AFP=연합뉴스 자료사진]    (샌프란시스코=연합뉴스) 권영전 특파원 = 엔비디아·AMD·구글 등과 인공지능(AI) 칩 대규모 공급 계약을 맺은 메타가 자체 AI 칩을 새로 선보이며 개발 난항설을 불식했다.    메타는 '메타 훈련·추론 가속기'(MTIA) 칩 제품군인 MTIA 300과 400, 450, 500 등 자체 AI 칩 4종을 11일(현지시간) 공개했다.    이 가운데 MTIA 300은 현재 생산에 돌입했고, 나머지 3종은 각각 약 6개월 주기로 내년까지 데이터센터에 배치할 계획이다.    MTIA 300은 페이스북·인스타그램 등 메타의 사회관계망서비스(SNS)에서 콘텐츠를 추천해주는 모델에 최적화한 칩이고, '아이리스'라는 코드명으로 알려진 MTIA 400은 이를 기반으로 생성 AI 모델 지원을 추가한 칩이다.    MTIA 450과 500은 AI 추론에 특화한 칩으로, 추론 성능의 핵심인 고대역폭메모리(HBM)의 대역폭을 크게 늘린 것이 특징이다.    메타는 엔비디아·AMD의 그래픽처리장치(GPU) 등 외부 칩을 도입하는 것과 자체 칩을 생산하는 것을 병행하는 데 대해 ""주류 칩은 가장 까다로운 작업인 AI 훈련을 위해 설계돼 추론과 같은 작업에는 비용 효율성이 떨어진다""며 ""MTIA는 반대로 추론에 최적화했다""고 설명했다.    이지운 송 엔지니어링 담당 부사장은 링크트인에 ""AI 모델이 전통적인 칩 개발 주기보다 더 빠르게 진화하고 있다""며 ""우리는 단일 설계에 장기적으로 베팅하기보다 반복해서 개선하기로 했다""고 개발 주기를 6개월 단위로 짧게 설정한 전략의 배경을 설명했다.    다만 송 부사장은 자체 칩 개발과 관련해 전 세계적인 메모리 칩 부족 현상을 걱정하기도 했다.    그는 ""HBM 공급 (부족)에 대해 매우 우려하고 있다""면서도 ""하지만 계획 중인 생산량에 (메모리) 공급은 확보했다고 보고 있다""고 미 경제방송 CNBC에 전했다.    앞서 미 정보기술(IT) 전문매체 디인포메이션은 메타가 자체 AI 칩 개발에 어려움을 겪어 '올림퍼스'라는 코드명으로 추진해온 AI 훈련용 칩 개발을 취소하고, '아이리스' 계획에서도 버전 하나를 폐기했다고 전한 바 있다.    메타는 이에 따라 훈련용으로는 외부 칩을 도입하고, 추론용으로는 자체 칩을 생산해 효율성을 높이려는 계획으로 선회한 것으로 풀이된다.    메타는 지난달 엔비디아와 수백억 달러, AMD와 1천억 달러 규모의 AI 칩 공급 계약을 잇달아 체결했고 구글과도 수십억 달러 규모의 AI칩 임대 계약을 맺은 바 있다.    comma@yna.co.kr"
AI 공포에 주가 40% 폭락…'18년 경력' CEO 물러난다,https://n.news.naver.com/mnews/article/015/0005261889?sid=105,"패키지로 팔던 포토샵, 구독제로 바꾼 '18년 경력 CEO'소프트웨어 업계 리더십 줄교체샨타누 나라옌 어도비 CEO ""물러날 것""매출 25배로 늘리며 현재 어도비 만들어 이미지 생성 AI·AI 네이티브 툴 등장'사스포칼립스' 공포에 주가 40% 빠져워크데이·클라비요도 리더십 개편



샨타누 나리옌 어도비 CEO./사진=AP세계 1위 이미지 편집 도구 ‘어도비 포토샵’은 2000년대까지만 해도 패키지 형태로 팔렸다. 이용자는 박스에 담긴 CD를 개인용 컴퓨터(PC)에 설치해 반영구적으로 쓸 수 있었다. 시중에 처음 판매된 포토샵1.0의 가격은 895달러. 지금 물가로 환산하면 2000달러를 웃도는 고가였다. 업무용으로 쓰는 전문가가 아니면 선뜻 써보기도 어려웠다. 2007년 어도비의 지휘봉을 잡은 샨타누 나라옌은 높은 진입 장벽이 문제라고 봤다. 그는 포토샵 요금체계를 월 20~70달러 내는 클라우드 기반 구독제로 바꾸며 사용자 기반을 크게 넓혔다. 이처럼 어도비를 서비스형 소프트웨어(SaaS) 기업으로 전환한 주역 나라옌 최고경영자(CEO)가 18년 만에 경영 일선에서 물러난다. 테크 전문매체 디인포메이션은 “인공지능(AI)의 위협에 대응하기 위해 소프트웨어 기업이 경영진 개편에 나선 상징적인 사례”라고 분석했다. 'AI 공포'에 주가 40% 하락나라옌 CEO는 12일(현지시간) “향후 수개월간 이사회와 협력해 후임자를 선정하고 원활한 인수인계를 진행할 것”이라고 밝혔다. 애플·실리콘그래픽스 등을 거친 나라옌 CEO는 1988년 부사장으로 어도비에 합류했다. 2007년 전임자 브루스 치젠의 뒤를 이어 18년간 회사를 이끌며 직원 수를 10배(3만 명)로 늘렸고 연 매출을 10억달러에서 250억달러로 키웠다.  그는 사임 소회를 밝히며 “새로운 시장 카테고리를 창출하는 리더십과 모든 영역에서 끊임없이 혁신을 추구하는 자세가 어도비의 매력이었다”고 회고했다. 하지만 성장의 주역인 그가 돌연 사임을 결정한 배경에는 ‘사스포칼립스(서비스형 소프트웨어 종말론)’로 불리는 위기론이 깔려 있다는 분석이 지배적이다. 최근 어도비는 구글 나노바나나와 미드저니 등 생성 AI 도구, 피그마·캔바 등 AI 네이티브 편집 툴의 거센 도전에 직면하며 ‘구세대 소프트웨어’라는 비판을 받아왔다. 이 같은 우려가 반영되면서 어도비 주가는 지난 1년간 38.49% 급락했다. 어도비는 자체 생성AI 도구 ‘파이어플라이’를 자사 제품군에 이식하며 정면 돌파를 시도하고 있다. 실제 이날 발표된 2026회계연도 1분기(2025년 12월~2026년 2월) 매출은 전년보다 12% 증가한 63억9000만달러로 역대 최대치를 경신했다. 특히 AI 기반 제품의 연간 매출은 전년 대비 3배 급증했다. 그럼에도 CEO 교체에 따른 불확실성이 커지며 시간외거래에서 주가는 한때 7% 이상 떨어졌다. 나라옌 CEO는 후임이 확정되기 전까지 직을 유지하고 이후에는 이사회 의장으로 활동할 계획이다. 워크데이·클라비요도 리더십 교체 리더십 변화가 어도비만의 일은 아니다. 인사관리 소프트웨어 기업 워크데이는 칼 에센바흐 CEO가 사임하고 공동 창업자인 아닐 부스리가 복귀한다고 지난달 9일 발표했다. 부스리는 2005년 워크데이를 공동 창업해 2014년부터 2020년까지 CEO로, 2020년부터 2024년까지는 공동 CEO로 재직했다. 부스리 CEO는 취임사에서 “AI는 SaaS보다 훨씬 더 큰 변화를 가져올 것“이라며 ”차세대 시장 선도 기업을 정의하는 핵심 요소가 될 것“이라고 밝혔다. 그는 1990년대 전사자원관리(ERP) 기업의 시초 격인 ‘피플소프트’의 초기 멤버이자 유명 벤처캐피털(VC)인 그레이락의 파트너로서 기술 트렌드를 읽는 안목을 증명했다는 평가를 받는다. 마케팅 소프트웨어 기업 클라비요는 부스리 CEO와 2020~2022년 워크데이를 함께 이끈 차노 페르난데즈를 공동 CEO로 영입했다. 창업자이자 기존 CEO인 앤드류 비알레키가 AI 제품 등 기술 고도화에 집중하고, 페르난데즈가 경영을 총괄하는 이원 구조다. 마이크로소프트(MS) 역시 지난해 말부터 대대적인 인력 재편에 들어갔다. 사티아 나델라 CEO는 지난해 10월 세일즈 총괄이던 저드슨 알토프를 상업 부문 총괄 CEO에 임명하고 본인은 “기술적 과업에 더 집중하겠다”고 밝혔다. 나델라 CEO는 MS의 연례 최대 컨퍼런스인 ‘이그나이트 2025’에도 불참했다. 소프트웨어 기반의 MS를 클라우드 인프라 중심으로 전환한 나델라 CEO가 AI 시대에 맞는 또 한 번의 체질 개선을 준비하고 있다는 분석이 제기된다.실리콘밸리=김인엽 특파원 inside@hankyung.com"
"직방, 가상오피스 플랫폼에 AI 다국어 기능 도입",https://n.news.naver.com/mnews/article/003/0013820531?sid=101,"[서울=뉴시스] 종합 프롭테크 기업 직방은 자사 가상오피스 플랫폼 '소마(Soma)'에 인공지능(AI) 기반 실시간 다국어 음성 인식과 번역 기능을 도입했다고 13일 밝혔다.(자료=직방 제공)  2026. 3. 13.  *재판매 및 DB 금지[서울=뉴시스]정유선 기자 = 종합 프롭테크 기업 직방은 가상오피스 플랫폼 '소마(Soma)'에 인공지능(AI) 기반 실시간 다국어 음성 인식과 번역 기능을 도입했다고 13일 밝혔다. 소마는 직방이 자체 개발한 메타버스 기반 가상오피스 플랫폼이다. 실제 사무실과 유사한 공간감을 온라인에서 구현했다.이번 업데이트로 소마 이용자는 가상공간에서 발화한 내용을 실시간으로 텍스트로 확인할 수 있으며, 자신이 선택한 언어로 상대방의 발언을 번역해 볼 수 있다.50개 이상의 언어와 145개 로케일이 지원되며 생성된 텍스트는 로컬 환경에 내려받아 회의 기록 등에 활용할 수 있다.이번 기능은 직전 대화 흐름을 참조하는 문맥 기반 번역 방식이 적용돼 다국적 팀 회의에서의 원활한 소통에 기여할 것으로 보인다. 대화 데이터는 서버에 저장되지 않고 참여자 사이에서만 처리되며 음성 인식과 번역 결과는 이중 경로 구조로 설계돼 보안 요건이 엄격한 환경에서도 활용이 가능하다. 직방 관계자는 ""이번 AI 다국어 기능은 언어 장벽을 낮추기 위한 첫걸음""이라며 ""소마가 단순한 가상 공간을 넘어 조직의 협업 방식 자체를 개선하는 플랫폼이 될 수 있도록 기능을 단계적으로 확대해 나갈 것""이라고 밝혔다."
포토샵도 필요 없는 시대…AI 압박 속 어도비 CEO 사임,https://n.news.naver.com/mnews/article/015/0005261832?sid=104,"실적은 좋지만 AI 영향 우려 커져포토샵, 일러스트레이션 등 AI로 가능해지면서어도비 주가 올해 들어 약 23% 떨어져



사진=REUTERS어도비의 최고경영자(CEO) 샨타누 나라옌이 인공지능(AI) 시대 경쟁력에 대한 투자자들의 우려 속에 사임하기로 했다. AI 기술 확산으로 창작 소프트웨어 시장의 경쟁이 격화되는 가운데 경영 교체가 단행되면서 향후 전략 방향에도 관심이 쏠리고 있다.13일 블룸버그에 따르면 나라옌 CEO는 후임자가 임명될 때까지 CEO직을 유지한 뒤 자리에서 물러날 예정이다. 그는 CEO에서 물러난 이후에도 어도비 이사회 의장으로 남는다. 나라옌은 지난 2007년 말 CEO에 취임해 약 18년 동안 회사를 이끌어왔다.시장에서는 이번 경영 교체가 어도비의 전략적 연속성과 혁신 속도, 자본 배분 전략 등에 대한 새로운 불확실성을 키울 수 있다고 보고 있다. 시장조사업체 이마케터의 그레이스 하먼 애널리스트는 “차기 경영진이 규율 있는 경영과 공격적인 AI 투자 사이에서 균형을 유지할 수 있을지가 투자자들의 핵심 관심사가 될 것”이라고 말했다.이 같은 소식이 전해지자 어도비 주가는 이날 시간외 거래에서 약 7% 하락했다. 어도비 주가는 올해 들어 약 23% 떨어지며 최근 3년 사이 최저 수준에 근접한 상태다.



어도비는 포토샵과 일러스트레이터 등 창작 소프트웨어를 기반으로 시장 지배력을 유지해 왔지만 최근 생성형 AI 기술 확산으로 경쟁 환경이 빠르게 바뀌고 있다. 구글 등 경쟁사들이 개발한 AI 영상 및 이미지 생성 모델이 등장하면서 기존 소프트웨어 중심의 창작 시장이 흔들리고 있다는 평가가 나온다.이에 대응해 어도비는 창작 및 마케팅 소프트웨어 전반에 AI 기능을 통합하고 이미지 생성 AI 모델 ‘파이어플라이’를 출시하는 등 AI 전략을 강화해 왔다. 회사 측에 따르면 파이어플라이 등 AI 중심 제품의 연간 반복 매출은 올해 회계연도 1분기에 전년 동기 대비 세 배 이상 증가했다. 지난해 9월 기준 이들 제품 매출은 2억5000만달러를 넘어섰다.나라옌 CEO는 재임 기간 동안 어도비의 성장을 이끌었다는 평가를 받는다. 그가 취임한 이후 회사 연간 매출은 약 6배 늘어 240억달러 수준에 이르렀고 직원 수는 약 7000명에서 3만명 이상으로 증가했다. 특히 그는 소프트웨어를 일회성 판매 방식에서 정기 구독 모델로 전환하는 전략을 성공적으로 추진한 것으로 평가된다.마이크로소프트 CEO 사티아 나델라는 소셜미디어 X(옛 트위터)에 “나라옌은 어도비에서 전설적인 성과를 남겼다”고 평가했다. 또 어도비가 2022년 인수를 추진했던 디자인 플랫폼 피그마의 딜런 필드 CEO도 “그는 어도비의 비전을 향해 끊임없이 노력해온 리더”라고 밝혔다.한편 어도비는 오는 5월까지 분기 매출을 64억3000만~64억8000만달러로 전망했다. 이는 시장 예상치와 비슷한 수준이다. 일부 항목을 제외한 주당순이익 전망은 5.80~5.85달러로 제시됐다.지난 회계연도 1분기(2월 27일 종료) 어도비 매출은 전년 대비 12% 증가한 64억달러를 기록해 시장 예상치(62억8000만달러)를 웃돌았다. 조정 주당순이익은 6.06달러로 시장 예상치인 5.88달러보다 높았다.다만 비교적 안정적인 실적에도 불구하고 최근 주가가 크게 하락하면서 경영 교체 압박이 커졌다는 분석도 나온다. 블룸버그 인텔리전스의 아누라그 라나 애널리스트는 “어도비의 재무 지표는 지난해 이후 큰 변화가 없지만 주가는 거의 40% 가까이 하락했다”며 “이 같은 주가 부진이 CEO 교체의 주요 배경일 가능성이 크다”고 말했다."
